sentence|translation|sdg
La Universidad Politécnica de Cartagena (UPCT) acoge en su salón de actos Isaac Peral del CIM, el lunes 2 de octubre de 10 a 12:00, jornada previa al Día de la Persona Emprendedora, la charla 'Divulgación sobre Emprendimiento en Arquitectura en el Siglo XXI'.|The Polytechnic University of Cartagena (UPCT) hosts at its Isaac Peral auditorium in the CIM, on Monday, October 2 from 10 to 12:00, a day before the Entrepreneurial Person Day, the talk 'Dissemination about Entrepreneurship in Architecture in the 21st Century'.|8
En ella intervendrán dos arquitectos que han alcanzado notoriedad por su faceta comunicadora: Lope de Toledo, conocido por divulgar contenidos arquitectónicos en medios de comunicación y plataformas de vídeo y audio; e Inma Bas, egresada de la Escuela de Arquitectura y Edificación de la UPCT, que comparte en redes sociales a sus 100.000 seguidores consejos para llevar una vida saludable.|It will feature two architects who have gained notoriety for their communication skills: Lope de Toledo, known for disseminating architectural content in media and video and audio platforms; and Inma Bas, a graduate of the School of Architecture and Building of the UPCT, who shares tips with her 100,000 followers on social media for leading a healthy life.|4
La finalidad de esta jornada es promover el intercambio de experiencias y conocimiento.|The purpose of this event is to promote the exchange of experiences and knowledge.|4
La asistencia es libre para startups, emprendedores, inversores, organismos y cualquier persona interesada en el emprendimiento.|Attendance is free for startups, entrepreneurs, investors, organizations, and anyone interested in entrepreneurship.|8
Enlace para reservar plaza.|Link to reserve a spot.|9
Esta jornada forma parte de la Estrategia C(i*EMP) de Fomento del Emprendimiento.|This event is part of the C(i*EMP) Strategy for the Promotion of Entrepreneurship.|8
En esta edición de 2023 el INFO cuenta con el apoyo de la Escuela de Negocios ENAE Business School como coorganizador, junto al que han sido beneficiarios de una subvención del Programa Impulso del Ecosistema Emprendedor Innovador de la Escuela de Organización Industrial (EOI), en el marco de la Estrategia Spain Up Nation, financiada por la Unión Europea  Next Generation EU, y en el marco del Plan de Recuperación, Transformación y Resiliencia, y apoyado por el Ministerio de Industria, Comercio y Turismo.|In this 2023 edition, INFO has the support of the ENAE Business School as a co-organizer, along with which they have been beneficiaries of a grant from the Impulse Program for the Innovative Entrepreneurial Ecosystem of the School of Industrial Organization (EOI), within the framework of the Spain Up Nation Strategy, funded by the European Union - Next Generation EU, and within the framework of the Recovery, Transformation, and Resilience Plan, and supported by the Ministry of Industry, Trade, and Tourism.|17
