sentence | translation | sdg
El pasado 26 de septiembre, el Consejo de Administración de la Autoridad Portuaria de Cartagena, aprobó por unanimidad nombrar a Fermín Rol Rol nuevo Director General de este organismo, trás la jubilación de José Pedro Vindel. | On September 26th, the Board of Directors of the Port Authority of Cartagena unanimously approved the appointment of Fermín Rol Rol as the new General Director of this organization, following the retirement of José Pedro Vindel. | 9
El nuevo Director es natural de Cáceres, ingeniero de Caminos, Canales y Puertos,  tiene 53 años y está casado. | The new Director is a native of Cáceres, a Civil Engineer specialized in Roads, Canals, and Ports, 53 years old, and married. | 9
Comenzó su actividad profesional en el Puerto de Cartagena hace 23 años, ha desempeñado diversos puestos de responsabilidad en materia de conservación y explotación. | He started his professional career at the Port of Cartagena 23 years ago, holding various positions of responsibility in conservation and operation. | 9
Hasta hace unos días era el Jefe de Área de Explotación de la APC. | Until a few days ago, he was the Head of the Exploitation Area of the Port Authority of Cartagena. | 9
Se adjunta entrevista aparecida en La Opinión, el domingo 2 de octubre. | An interview published in La Opinión newspaper on Sunday, October 2nd, is attached. | 9
