sentence | translation | sdg
El I Seminario de Hidroaviación de España, organizado por el Ayuntamiento de Los Alcázares y la Universidad Politécnica de Cartagena, ha proseguido esta mañana en la UPCT con sesiones de trabajo sobre el impacto medioambiental de los hidroaviones y su utilidad para tareas de interés público. | The I Hydroaviation Seminar in Spain, organized by the City Council of Los Alcázares and the Polytechnic University of Cartagena, continued this morning at the UPCT with working sessions on the environmental impact of seaplanes and their usefulness for public interest tasks. | 15
"La hidroaviación se puede utilizar no sólo para extinción de incendios, también para vigilancias de todo tipo y para labores de salvamento marítimo", ha defendido uno de los ponentes y organizadores de la jornada, Jesús Borja, miembro de la Asociación Española de Hidroaviación y de la Fundación Aeronáutica Mallorquina, quien ha argumentado que los hidroaviones son menos contaminantes que otras aeronaves y que sus patines no afectan a la flora y fauna marítima. | "Hydroaviation can be used not only for firefighting, but also for all types of surveillance and maritime rescue tasks," defended one of the speakers and organizers of the event, Jesús Borja, a member of the Spanish Hydroaviation Association and the Aeronautical Foundation of Mallorca, who argued that seaplanes are less polluting than other aircraft and that their skis do not affect marine flora and fauna. | 13
"En Estados Unidos y Canadá se utilizan en los espacios de mayor protección medioambiental", ha ejemplificado. | "In the United States and Canada, they are used in the most environmentally protected areas," he exemplified. | 15
Los aficionados a la hidroaviación reclaman contar con más hidrosuperficies autorizadas para amerizar, una solicitud que está en trámite en el caso de Los Alcázares, que se convertiría así en el tercer municipio de España en contar con una. | Hydroaviation enthusiasts demand more authorized seaplane bases for landing, a request that is being processed in the case of Los Alcázares, which would thus become the third municipality in Spain to have one. | 9
"Partimos de la base de que todas las aguas del litoral español son de dominio público", ha señalado Borja, indicando que para las embarcaciones no existen las restricciones que tienen los hidroaviones debido a la Ley de Navegación Aérea de 1960, aún en vigor. | "We start from the assumption that all waters off the Spanish coast are public domain," Borja pointed out, indicating that boats do not have the restrictions that seaplanes face due to the 1960 Air Navigation Act, still in force. | 14
