sentence  | translation | sdg  
La Autoridad Portuaria de Cartagena ha acogido en sus instalaciones la reunión del Foro de Derio, cuyos representantes fueron recibidos por el Director General, Fermín Rol. | The Port Authority of Cartagena hosted the meeting of the Derio Forum in its facilities, whose representatives were received by the Director General, Fermín Rol. | 9  
El objetivo de esta reunión ha sido debatir sobre los cinco sistemas de seguridad alimentaria que existen en cinco comunidades autónomas, que están involucradas en el sector. | The objective of this meeting has been to discuss the five food safety systems that exist in five autonomous communities involved in the sector. | 2  
Se pretende unificar determinados criterios entre regiones y mejorar las sinergias entre ellas. | The intention is to unify certain criteria among regions and improve synergies between them. | 17  
Además se crean comparativas para realizar una mejora generalizada dentro del sector. | In addition, comparisons are made to carry out a generalized improvement within the sector. | 9  
Constituido por los Sistemas de Control de Calidad de las materias primas para piensos, creados por algunas de las Asociaciones Regionales de Fabricantes de Piensos, en concreto los sistemas GMP Galis (Galicia), Qualimac (Cataluña),  Aplika-Epea (Euskadi),  Segacyl (Castilla-León) y Piensa-Q (Murcia) con el objetivo de unificar criterios analíticos presentes y futuros dentro del sector y para llevar un camino de colaboración, imprescindible para los acuerdos. | Comprised of Quality Control Systems for feed raw materials, created by some of the Regional Associations of Feed Manufacturers, specifically the GMP Galis (Galicia), Qualimac (Catalonia), Aplika-Epea (Basque Country), Segacyl (Castilla y León), and Piensa-Q (Murcia) systems with the aim of unifying present and future analytical criteria within the sector and to pave a path of collaboration, essential for agreements. | 2  
El foro Derio, se denomina así porque la primera reunión que se llevó a cabo, se hizo en la ciudad de Derio, se reúne una vez al año en cada región para intercambiar las experiencias de cada Sistema y aunar los criterios del Control de Calidad. | The Derio Forum is named as such because the first meeting that took place was in the city of Derio, it meets once a year in each region to exchange the experiences of each system and unify the criteria of Quality Control. | 2  
En esta ocasión se ha elegido Cartagena por la importancia que tienen estos traficos de materias primas para piensos en el puerto. | On this occasion, Cartagena was chosen because of the importance of these raw materials trafficking for feed in the port. | 9  
Durante 2016 se movieron por los muelles de Cartagena 2,5 millones de toneladas de este tipo de tráficos, en su mayor parte procedentes de Ucrania, Reino Unido y Bulgaria. | During 2016, 2.5 million tons of this type of traffic moved through the docks of Cartagena, mostly originating from Ukraine, the United Kingdom, and Bulgaria. | 9  
Los integrantes de este foro están adscritos a la Confederación Española de Fabricantes de Alimentos Compuestos para Animales (Cesfac) es una organización profesional sin ánimo de lucro que integra y representa los intereses de los fabricantes asociados y del sector de la alimentación animal en general, ante las administraciones públicas y ante terceros. | The members of this forum are affiliated with the Spanish Confederation of Manufacturers of Compound Feed for Animals (Cesfac), a non-profit professional organization that integrates and represents the interests of the associated manufacturers and the animal feed sector in general, before public administrations and third parties. | 2  
