sentence | translation | sdg
La competición Greenpower, organizada por la Escuela de Ingeniería Industrial de la UPCT, ha recalado de nuevo en el circuito de Cartagena. | The Greenpower competition, organized by the School of Industrial Engineering of the UPCT, has once again arrived at the Cartagena circuit. | 4
Ocho equipos han participado este domingo en una edición en la que alrededor de 50 estudiantes de Secundaria y Formación Profesional han demostrado sus habilidades para diseñar y fabricar y ganar la competición con su prototipo de coche eléctrico. | Eight teams participated this Sunday in an edition in which around 50 high school and vocational training students have demonstrated their skills to design and manufacture and win the competition with their electric car prototype. | 4
El ganador es quien consiga el vehículo más eficiente en pista. | The winner is the one who achieves the most efficient vehicle on the track. | 4
Entre los ocho equipos que toman salida se encuentran estudiantes de País Vasco, Navarra, Comunidad Valenciana y Región de Murcia. | Among the eight teams that start, there are students from the Basque Country, Navarra, Valencia, and the Region of Murcia. | 4
La Escuela de Industriales de la UPCT puso en marcha la competición Greenpower Región de Murcia en 2018 junto con Greenpower Iberia. | The School of Industrial Engineering of the UPCT started the Greenpower Region of Murcia competition in 2018 along with Greenpower Iberia. | 4
Desde entonces, cada año organiza diferentes eventos en los que los equipos participantes demuestran sus habilidades para diseñar y fabricar prototipos de competición, para la optimización de los sistemas a integrar en estos vehículos, para la gestión de la carrera y para pilotar sus propios prototipos en un circuito de velocidad, a través de lo cual se potencia las habilidades de estos alumnos para el estudio de las titulaciones universitarias del ámbito de la ingeniería industrial, explica el director del centro, Patricio Franco. | Since then, every year it organizes different events in which participating teams demonstrate their skills to design and manufacture competition prototypes, for the optimization of the systems to be integrated into these vehicles, for race management, and for piloting their own prototypes on a speed circuit, through which the skills of these students are enhanced for the study of university degrees in the field of industrial engineering, explains the center's director, Patricio Franco. | 4
La jornada ha comenzado a las 10:00 de la mañana con la revisión de vehículos. | The day started at 10:00 in the morning with the vehicle inspection. | 9
La competición se ha desarrollado entre las 14:00 y las 16:00 horas. | The competition took place between 14:00 and 16:00 hours. | 9
