sentence|translation|sdg
La Comisión Permanente de la Cátedra Interuniversitaria de Medio Ambiente Autoridad Portuaria de Cartagena - Campus Mare Nostrum (APC-CMN), integrada por representantes de la Autoridad Portuaria, la Universidad Politécnica de Cartagena y la Universidad de Murcia, ha abierto este lunes el plazo de solicitud, que concluye el 30 de noviembre, para optar a tres contratos de investigación en materia medioambiental en el ámbito portuario.|The Permanent Commission of the Interuniversity Chair of Environment of the Port Authority of Cartagena - Campus Mare Nostrum (APC-CMN), composed of representatives from the Port Authority, the Polytechnic University of Cartagena, and the University of Murcia, opened on Monday the application period, which ends on November 30, to apply for three research contracts in environmental matters in the port area.|9
Las propuestas de investigación han de estar relacionadas con las siguientes temáticas: Red Natura 2000; biodiversidad y gestión responsable de las especies y hábitats; ruido subacuático; contaminación marina y suelos contaminados; desarrollos tecnológicos relacionados con la difusión, comunicación o gestión de actuaciones ambientales.|Research proposals must be related to the following topics: Natura 2000 Network; biodiversity and responsible management of species and habitats; underwater noise; marine pollution and contaminated soils; technological developments related to the dissemination, communication, or management of environmental actions.|15
La Cátedra Interuniversitaria de Medio Ambiente Autoridad Portuaria de Cartagena - Campus Mare Nostrum tiene atribuidas, entre sus funciones, la de promover y realizar estudios e investigaciones multidisciplinares sobre materias relacionadas con el medio ambiente en el entorno del Puerto de Cartagena, que puedan ser aprovechables y explotables por la Autoridad Portuaria en beneficio de su buen desarrollo y gestión final.|The Interuniversity Chair of Environment of the Port Authority of Cartagena - Campus Mare Nostrum is assigned, among its functions, the promotion and conduct of multidisciplinary studies and research on environmental issues in the area of the Port of Cartagena, which can be used and exploited by the Port Authority for its proper development and final management.|9
Esta convocatoria está abierta a propuestas lideradas por un investigador perteneciente a una de las dos universidades públicas de la Región de Murcia (Universidad de Murcia y Universidad Politécnica de Cartagena), en colaboración con otras Universidades, fundaciones, empresas y demás instituciones públicas y privadas que puedan contribuir al desarrollo del conocimiento en cada campo temático.|This call is open to proposals led by a researcher from one of the two public universities in the Region of Murcia (University of Murcia and Polytechnic University of Cartagena), in collaboration with other universities, foundations, companies, and other public and private institutions that can contribute to the development of knowledge in each thematic field.|4
Cada equipo de investigación podrá presentar sólo una propuesta, cuyo importe no exceda de 15.000 euros.|Each research team may submit only one proposal, with an amount not exceeding 15,000 euros.|9
La Comisión Permanente de la Cátedra será la encargada de evaluar las propuestas de investigación, cuya resolución será comunicada a cada investigador principal antes del 31 de diciembre de este año.|The Permanent Commission of the Chair will be responsible for evaluating the research proposals, and the decision will be communicated to each principal investigator before December 31 of this year.|4
La Autoridad Portuaria de Cartagena tiene fijados entre sus objetivos estratégicos ser excelentes en la gestión portuaria.|The Port Authority of Cartagena has set among its strategic objectives to excel in port management.|9
Con estos proyectos se establecen sinergias para avanzar hacia un puerto más sostenible, priorizando el cuidado del entorno y la protección de nuestra flora y fauna, la mejora de la calidad del agua, la optimización de consumos o la reducción de la huella ecológica.|These projects establish synergies to move towards a more sustainable port, prioritizing the care of the environment and the protection of our flora and fauna, improving water quality, optimizing consumption, and reducing the ecological footprint.|15
La Cátedra, creada en 2015, permite la colaboración permanente entre la Autoridad Portuaria y las universidades públicas de la Región y está desarrollando actividades de investigación, transferencia, asistencia técnica y formación en materia de medioambiente.|The Chair, created in 2015, allows for permanent collaboration between the Port Authority and the public universities of the Region, and is conducting research, transfer, technical assistance, and training activities on environmental matters.|4
