sentence|translation|sdg
El catedrático del área de Producción Vegetal de la UPCT, Alejandro Pérez Pastor, ha impartido este mes un curso sobre Riego deficitario controlado en la Universidad Federal de Lavras, en Brasil.|The professor in the Vegetable Production area of UPCT, Alejandro Pérez Pastor, has taught a course this month on 'Controlled deficit irrigation' at the Federal University of Lavras, in Brazil.|4
Este curso, de tres semanas de duración, forma parte de un programa de posgrado en Recursos Hídricos.|This three-week course is part of a postgraduate program in Water Resources.|6
El curso lo han realizado medio centenar de estudiantes de doctorado y profesores de Agronomía.|The course was taken by half a hundred doctoral students and professors of Agronomy.|4
Han participado como ponentes los estudiantes de doctorado de la UPCT: Abdel Temnani, Susana Zapata, Pablo Berrios y Raúl Pérez.|The doctoral students from UPCT, Abdel Temnani, Susana Zapata, Pablo Berrios, and Raúl Pérez, have participated as speakers.|4
El profesor Pérez Pastor, del departamento de Ingeniería Agronómica, está especializado en el manejo del riego y en el estudio de la respuesta fisiológica y agronómica de los cultivos al déficit hídrico.|Professor Pérez Pastor, from the Department of Agronomic Engineering, specializes in irrigation management and the study of the physiological and agronomic response of crops to water deficit.|2
