sentence | translation | sdg
Investigadores de la Escuela de Ingeniería Agronómica de la Universidad Politécnica de Cartagena (UPCT) participan en el proyecto OLEACOVER para evaluar el efecto del tipo de cubiertas vegetales y su manejo en olivar en seto sobre la funcionalidad del suelo y el secuestro de carbono para garantizar la sostenibilidad del sistema agrario y así contribuir a la mitigación y adaptación al cambio climático. | Researchers from the School of Agricultural Engineering at the Polytechnic University of Cartagena (UPCT) participate in the OLEACOVER project to evaluate the effect of the type of vegetative covers and their management in hedgerow olive groves on soil functionality and carbon sequestration to ensure the sustainability of the agricultural system and thus contribute to climate change mitigation and adaptation. | 13
El proyecto Factores que condicionan el secuestro de C, las emisiones de gases de efecto invernadero, la funcionalidad del suelo y la biodiversidad en olivar en seto con cubierta vegetal (PID2021-122998OB-I00) contempla, entre otras acciones, realizar muestreos de suelo, así como análisis de diferentes parámetros de salud del suelo, biodiversidad, emisiones de GHG y capacidad del suelo para almacenar carbono. | The project 'Factors conditioning carbon sequestration, greenhouse gas emissions, soil functionality, and biodiversity in hedgerow olive groves with vegetative cover' (PID2021-122998OB-I00) contemplates, among other actions, soil sampling, as well as analysis of different soil health parameters, biodiversity, GHG emissions, and soil's capacity to store carbon. | 15
También se sembrarán diferentes mezclas de semillas comerciales para comparar su manejo y eficiencia en comparación con el desarrollo de vegetación espontánea o el uso de herbicidas. | Different mixes of commercial seeds will also be planted to compare their management and efficiency compared to the development of spontaneous vegetation or the use of herbicides. | 2
Los investigadores, además, monitorizarán el estado hídrico del suelo y de la planta e instalarán sensores para obtener datos temporales periódicos. | The researchers will also monitor the soil and plant water status and install sensors to obtain periodic temporal data. | 6
El proyecto, que comenzó el pasado octubre y tiene una duración de cuatro años, contempla aspectos del ciclo de vida y socioeconómicos. | The project, which started last October and has a duration of four years, contemplates life cycle and socioeconomic aspects. | 8
Hace hincapié en la importancia ambiental, económica y conductual del uso de cubiertas vegetales. | It emphasizes the environmental, economic, and behavioral importance of using vegetative covers. | 2
Los ensayos del proyecto, financiado por el Ministerio de Ciencia e Innovación se realizan en una finca de producción comercial en la localidad albaceteña de Minateda. | Trials of the project, funded by the Ministry of Science and Innovation, are carried out on a commercially producing farm in the town of Minateda, Albacete. | 8
