sentence | translation | sdg
Los colegios profesionales y la Escuela de Industriales han entregado este viernes, durante el acto de graduación, premios a los mejores trabajos fin de estudios y a la Excelencia Académica. | Professional associations and the School of Industrial Engineers have awarded prizes this Friday, during the graduation ceremony, to the best final projects and to Academic Excellence. | 4
El Premio Agustín Diéguez 2023 al mejor TFM de las titulaciones sin atribuciones profesionales, otorgado por la ETSII y entregado por el vicerrector Juan Ángel Pastor, ha sido para Mabel Scarlett Cuevas, del máster en Energías Renovables, por su trabajo 'Hidrógeno verde a partir de radiación solar', dirigido por Antonio Urbina. | The Agustín Diéguez 2023 Award for the best Master's Thesis of the degrees without professional attributions, granted by the ETSII and presented by the Vice Chancellor Juan Ángel Pastor, has been awarded to Mabel Scarlett Cuevas, from the Master's in Renewable Energies, for her work 'Green Hydrogen from solar radiation', directed by Antonio Urbina. | 4
El premio al mejor TFM en Ingeniería Industrial, concedido por el COIIRM, ha recaído en José Miguel Ballester Arce por su trabajo 'Purificación de Biogás para inyección a red', dirigido por Ángel Molina y codirigido por Juan Antonio López. | The award for the best Master's Thesis in Industrial Engineering, granted by the COIIRM, has been awarded to José Miguel Ballester Arce for his work 'Biogas purification for grid injection', directed by Ángel Molina and co-directed by Juan Antonio López. | 4
Los accésits han sido para Juan Pedro Sánchez Conesa, José Francisco Ortega García e Isabel Morales Aragón. | The honorable mentions have been for Juan Pedro Sánchez Conesa, José Francisco Ortega García, and Isabel Morales Aragón. | 4
Ha dado los galardones el decano del Colegio de Ingenieros Industriales, Marcos Mateos. | The awards were given by the dean of the College of Industrial Engineers, Marcos Mateos. | 4
El Premio a la Excelencia Académica del Colegio de Ingenieros Técnicos Industriales ha sido entregado por el tesorero de la institución, Alejandro Ochoa, a Pilar Villaescusa de Gea. | The Academic Excellence Award from the College of Technical Industrial Engineers was presented by the treasurer of the institution, Alejandro Ochoa, to Pilar Villaescusa de Gea. | 4
Ha recibido un accésit Jesús Cabezos Olmedos, recientamente premiado por su simulación de la automatización de la terminal marítima. | Jesús Cabezos Olmedos has received an honorable mention, recently awarded for his simulation of the automation of the maritime terminal. | 4
