sentence | translation | sdg
"La comunidad frente a la comercialización" es el lema de la Semana Internacional del Acceso Abierto, que se celebra del 23 al 29 de octubre. | "Community versus commercialization" is the motto of the International Open Access Week, which takes place from October 23 to 29. | 4
El tema fomenta una conversación honesta sobre los enfoques de la ciencia abierta que priorizan los mejores intereses del público y de la comunidad académica, y los que no lo hacen. | The theme promotes an honest conversation about open science approaches that prioritize the best interests of the public and the academic community and those that do not. | 4
Para celebrar este evento internacional, el CRAI Biblioteca ha elaborado esta página que contiene información, datos del Repositorio Digital y de la monitorización del acceso abierto en la UPCT, actividades programadas y enlaces de interés. | To celebrate this international event, the CRAI Library has created this page that contains information, data from the Digital Repository and monitoring of open access at UPCT, scheduled activities, and links of interest. | 9
La Red de Bibliotecas Universitarias Españolas (REBIUN) recoge en su Portal de Acceso Abierto las acciones y actividades que las diversas Universidades celebran durante la International Open Access Week. | The Spanish Network of University Libraries (REBIUN) gathers on its Open Access Portal the actions and activities that the various Universities celebrate during the International Open Access Week. | 4
La Semana Internacional del Acceso Abierto la organiza la Scholarly Publishing and Academic Resources Coalition (SPARC) para promover el acceso abierto en el mundo académico. | The International Open Access Week is organized by the Scholarly Publishing and Academic Resources Coalition (SPARC) to promote open access in the academic world. | 4
La Recomendación de la UNESCO sobre la Ciencia Abierta, adoptada por sus 193 Estados miembros, destaca la necesidad de priorizar a la comunidad por encima de la comercialización y apoyar "modelos de publicación no comerciales y modelos de publicación colaborativa sin gastos de procesamiento de artículos". | UNESCO's Recommendation on Open Science, adopted by its 193 member states, highlights the need to prioritize the community over commercialization and to support "non-commercial publishing models and collaborative publishing models without article processing charges". | 4
