sentence | translation | sdg
La Universidad Politécnica de Cartagena (UPCT) estará presente un año más en el Fan Futura Fest, que celebra su tercera edición el último viernes y sábado de este mes en San Javier, con varios talleres de divulgación científica y tecnológica, en línea con los valores de sostenibilidad que promueve el festival. | The Polytechnic University of Cartagena (UPCT) will be present once again at the Fan Futura Fest, celebrating its third edition on the last Friday and Saturday of this month in San Javier, with various workshops on scientific and technological dissemination, in line with the sustainability values promoted by the festival. | 9
Un punto de recogida de dispositivos electrónicos en desuso para concienciar sobre la importancia de reciclar sus componentes; talleres de reciclaje de plástico para convertirlo en filamento 3D, gracias a maquetas construidas por la asociación estudiantil UPCT Makers; o un taller de impresión 3D usando ese filamento reciclado para crear piezas con diferentes diseños son algunas de las propuestas que la UPCT llevará al festival este año. | A collection point for unused electronic devices to raise awareness about the importance of recycling their components; plastic recycling workshops to turn it into 3D filament, thanks to models built by the student association UPCT Makers; or a 3D printing workshop using that recycled filament to create pieces with different designs are some of the proposals that UPCT will bring to the festival this year. | 12
Como novedad en esta edición, se realizará también una actividad de cultivo hidropónico donde los asistentes podrán crear su propio mini-huerto doméstico y aprender los principios del compostaje como fuente orgánica de nutrientes. | As a novelty in this edition, there will also be a hydroponic cultivation activity where attendees can create their own mini home garden and learn the principles of composting as an organic source of nutrients. | 2
Podrán llevarse a casa una bolsa de té de compost como sustrato y la maceta hidropónica construida para continuar con el mantenimiento de ella. | They can take home a compost tea bag as a substrate and the hydroponic pot built to continue maintaining it. | 15
El objetivo es incentivar una agricultura más sostenible que no dependa del uso de fertilizantes, así como el consumo de frutas y verduras como parte de una dieta saludable. | The goal is to promote more sustainable agriculture that does not depend on the use of fertilizers, as well as the consumption of fruits and vegetables as part of a healthy diet. | 2
Estos talleres divulgativos están coordinados por la Unidad de Cultura Científica y de la Innovación (UCC+i) de la UPCT, que cuenta con la colaboración de la Fundación Española para la Ciencia y la Tecnología  Ministerio de Ciencia e Innovación. | These dissemination workshops are coordinated by the Scientific Culture and Innovation Unit (UCC+i) of UPCT, which collaborates with the Spanish Foundation for Science and Technology - Ministry of Science and Innovation. | 9
