sentence | translation | sdg
La Autoridad Portuaria de Cartagena y el Gobierno regional murciano han solicitado 1,3 millones de euros de fondos europeos para realizar todos los estudios y proyectos necesarios que permitirán desarrollar la Zona de Actividades Logísticas (ZAL) de Cartagena, según dieron a conocer en la reunión mantenida hoy en la Cámara de Comercio de Cartagena. | The Port Authority of Cartagena and the regional government of Murcia have requested 1.3 million euros in European funds to carry out all the necessary studies and projects that will allow the development of the Logistics Activities Zone (ZAL) of Cartagena, as reported today in the meeting held at the Cartagena Chamber of Commerce. | 9
El director general indicó que la Región ha solicitado 1,3 millones de euros para la ZAL de Cartagena, tal y como se acordó el pasado 13 de enero en la reunión de la Mesa de Trabajo de la ZAL de Cartagena y que la Unión Europea aportaría el 50 por ciento de los fondos necesarios para el proyecto y el resto se sufragará entre la Consejería de Fomento e Infraestructuras, el Instituto de Fomento y la Autoridad Portuaria de Cartagena. | The general director indicated that "The Region has requested 1.3 million euros for the ZAL of Cartagena, as agreed on January 13 in the meeting of the Work Table of the ZAL of Cartagena" and that "The European Union would provide 50 percent of the funds necessary for the project, and the rest will be financed between the Ministry of Development and Infrastructure, the Institute of Development, and the Port Authority of Cartagena." | 9
Así lo trasladaron al presidente de la Cámara de Comercio de Cartagena, Miguel Martínez; y al presidente la Confederación Comarcal de Organizaciones Empresariales de Cartagena (Coec), Pedro Pablo Hernández. | This was communicated to the president of the Chamber of Commerce of Cartagena, Miguel Martínez; and to the president of the Regional Confederation of Business Organizations of Cartagena (Coec), Pedro Pablo Hernández. | 8
Antonio Sevilla indicó este proyecto supone la elaboración de un Plan básico que contempla la eliminación de los accesos ferroviarios a la dársena de Cartagena, el traslado del depósito franco a Los Camachos y la planificación de infraestructuras básicas que son necesarias. | Antonio Sevilla stated, "This project involves the development of a basic plan that includes the removal of railway access to the dock of Cartagena, the transfer of the free zone to Los Camachos, and the planning of necessary basic infrastructures." | 9
La solicitud de ayudas fue presentada por el Ministerio de Fomento dentro de la convocatoria del mecanismo Conecta Europa (Connecting Europe Facility (CEF) de la Unión Europea, que contempla la financiación de 47 proyectos de transporte para toda España, que supondrán una inversión de más de 500 millones de euros. | The request for assistance was submitted by the Ministry of Development within the call for the 'Connect Europe' mechanism (Connecting Europe Facility (CEF) of the European Union, which includes funding for 47 transport projects throughout Spain, representing an investment of more than 500 million euros. | 9
Entre estos proyectos se encuentra el desarrollo de la ZAL de Cartagena, que es una actuación dentro del ámbito del Corredor Mediterráneo. | Among these projects is the development of the ZAL of Cartagena, which is an action within the scope of the Mediterranean Corridor. | 9
La ZAL de Cartagena permitirá incrementar la actividad económica de la ciudad portuaria reforzando el sector logístico de la Región como uno de los motores de la economía y de la generación de empleo, mediante una actuación encaminada a impulsar la actividad portuaria y su conexión ferroviaria, aérea y por carretera. | The ZAL of Cartagena will increase the economic activity of the port city by strengthening the logistics sector of the Region as one of the drivers of the economy and job creation, through actions aimed at boosting port activity and its railway, air, and road connections. | 8
El director general indicó que este proyecto, junto con la ZAL de Murcia, están incluidas en la red transeuropea de Transporte, que pretende lograr un espacio único europeo de transporte con una política competitiva y sostenible. | The general director stated that "This project, along with the ZAL of Murcia, are included in the Trans-European Transport Network, which aims to achieve a single European transport space with a competitive and sustainable policy." | 9
El CEF es un instrumento de la Unión Europea que financia proyectos de interés común de las redes transeuropeas de transportes, telecomunicaciones y energía. | The CEF is an instrument of the European Union that funds projects of common interest in the trans-European networks of transports, telecommunications, and energy. | 9
