sentence | translation | sdg
Imprimir partes del cerebro, biosensores para intentar regenerar nervios ópticos, fibras de seda para reemplazar nervios y recuperar movilidad, tecnología cuántica para probar fármacos, realidad aumentada sobre un maniquí impreso en 3D para formar a cirujanos | Print parts of the brain, biosensors to try to regenerate optic nerves, silk fibers to replace nerves and restore mobility, quantum technology to test drugs, augmented reality on a 3D printed mannequin to train surgeons... | 3
en el Congreso de Ingeniería Biomédica que se celebra en la UPCT desde este miércoles y hasta el viernes se darán a conocer multitud de avances para el cuidado de la salud a través de la tecnología. | At the Biomedical Engineering Congress held at the UPCT from this Wednesday until Friday, a multitude of advances for healthcare through technology will be presented. | 3
Biodispositivos, bioinformática, bionanotecnologías, fabricación aditiva de productos sanitarias, ingeniería clínica, ingeniería de tejidos, órganos artificiales y impresión, simulación quirúrgica, robótica médica o telemedicina son algunas de las áreas temáticas del Congreso Anual de la Sociedad Española de Ingeniería Biomédica (CASEIB), al que se han inscrito 250 investigadores, docentes, profesionales y estudiantes. | Biodevices, bioinformatics, bionanotechnologies, additive manufacturing of healthcare products, clinical engineering, tissue engineering, artificial organs and printing, surgical simulation, medical robotics, or telemedicine are some of the thematic areas of the Annual Congress of the Spanish Society of Biomedical Engineering (CASEIB), in which 250 researchers, teachers, professionals, and students have registered. | 3
El Congreso contará con sesiones especiales sobre biomateriales, nanomedicina y neurotecnologías así como mesas redondas sobre el uso sanitario de la Inteligencia Artificial y sobre startups de Ingeniería Biomédica, en la que el profesor de la UPCT Manuel Burgos presentará la empresa spin-off Flowgy, dedicada al modelado y simulación digital para diagnóstico y planificación quirúrgica de la vía aérea. | The Congress will have special sessions on biomaterials, nanomedicine, and neurotechnologies as well as round tables on the healthcare use of Artificial Intelligence and on Biomedical Engineering startups, where UPCT professor Manuel Burgos will present the spin-off company Flowgy, dedicated to digital modeling and simulation for the diagnosis and surgical planning of the airway. | 3
También participarán otras compañías creadas o integradas por egresados de la Politécnica de Cartagena. | Other companies created or integrated by graduates of the Polytechnic University of Cartagena will also participate. | 3
La Universidad Politécnica de Cartagena organiza este congreso junto a la Sociedad Española de Ingeniería Biomédica. | The Polytechnic University of Cartagena organizes this congress together with the Spanish Society of Biomedical Engineering. | 4
Preside el comité organizador Joaquín Roca, coordinador del grado en Ingeniería Biomédica que imparte la UPCT, y la secretaria es Lola Ojados, coordinadora del Laboratorio de Investigación, Desarrollo e Innovación en Tecnologías Biomédicas (LIDiTeB) que la Politécnica tiene en el hospital Santa Lucía. | Joaquín Roca, coordinator of the Biomedical Engineering degree at UPCT, chairs the organizing committee, and the secretary is Lola Ojados, coordinator of the Research, Development, and Innovation Laboratory in Biomedical Technologies (LIDiTeB) located at the Polytechnic University's Santa Lucía hospital. | 4
El CASEIB 2023 comienza este miércoles a las 9:30 en el antiguo Hospital de Marina, hoy Escuela de Ingeniería Industrial de la UPCT, y será inaugurado a las 13 horas por el consejero de Universidades, Juan María Vázquez, y la rectora de la UPCT, Beatriz Miguel. | CASEIB 2023 begins this Wednesday at 9:30 at the former Marina Hospital, now the School of Industrial Engineering of UPCT, and will be inaugurated at 13:00 by the University Councilor, Juan María Vázquez, and the Rector of UPCT, Beatriz Miguel. | 4
Coincidiendo con el Congreso, una veintena de estudiantes de las politécnicas de Cluj-Napoca (Rumanía) y Riga (Letonia), que forman parte como la UPCT de la Universidad Europea de Tecnología (EUt+), y de la politécnica de Poznan (Polonia) se están formando esta semana en diseño, modelado e impresión 3D de prótesis en los laboratorios del Servicio de Diseño Industrial y Cálculo Científico (SEDIC) de la Politécnica de Cartagena y en su FabLab. | Coinciding with the Congress, a group of twenty students from the polytechnics of Cluj-Napoca (Romania) and Riga (Latvia), who are part of the European University of Technology (EUt+) along with UPCT, and the polytechnic of Poznan (Poland), are this week training in design, modeling, and 3D printing of prosthetics in the laboratories of the Industrial Design and Scientific Calculation Service (SEDIC) of the Polytechnic University of Cartagena and its FabLab. | 4
