sentence | translation | sdg
La rectora de la UPCT, Beatriz Miguel, acompañada por la vicerrectora Investigación, Transferencia y Divulgación, Catalina Egea, y la responsable de Desarrollo y Promoción de EUT+, Teresa Allepuz, se han reunido hoy con el diplomático murciano y secretario general adjunto de la Unión por el Mediterráneo (UfM), Álvaro Albacete Perea, responsable, además, del área Educación superior e Investigación. | The rector of UPCT, Beatriz Miguel, accompanied by the vice-rector of Research, Transfer and Dissemination, Catalina Egea, and the head of Development and Promotion of EUT+, Teresa Allepuz, met today with the Murcian diplomat and Deputy Secretary General of the Union for the Mediterranean (UfM), Álvaro Albacete Perea, who is responsible for the area of "Higher Education and Research". | 4
En este primer encuentro Álvaro Albacete ha conocido la EUt+, la alianza de las 4 universidades politécnicas españolas (UP4), así como otras redes a las que pertenece la UPCT, y se han presentado las líneas de actuación de la UfM. | In this first meeting, Álvaro Albacete has learned about the EUt+, the alliance of the 4 Spanish polytechnic universities (UP4), as well as other networks to which UPCT belongs, and the lines of action of the UfM have been presented. | 4
También, se ha abordado el potencial de Erasmus Plus en esta zona mediterránea. | The potential of Erasmus Plus in this Mediterranean area has also been discussed. | 4
Hay muchos puntos en común entre ambas entidades y, consecuentemente, numerosas posibilidades de colaboración. | There are many common points between both entities and, consequently, numerous possibilities for collaboration. | 17
La Unión por el Mediterráneo -un foro de debate con sede en Barcelona- es una organización intergubernamental integrada por 43 países de Europa y la cuenca mediterránea. | The Union for the Mediterranean - a forum based in Barcelona - is an intergovernmental organization composed of 43 countries from Europe and the Mediterranean basin. | 16
Su objetivo principal es mejorar la integración en la región mediterránea para potenciar el desarrollo socioeconómico de los diferentes países que la componen. | Its main objective is to improve integration in the Mediterranean region to enhance the socioeconomic development of the different countries that compose it. | 10
La Unión por el Mediterráneo se centra en impulsar el desarrollo humano y promover el desarrollo sostenible. | The Union for the Mediterranean focuses on promoting human development and sustainable development. | 1
Los proyectos e iniciativas de la Unión por el Mediterráneo se desarrollan en seis áreas de actividad siguiendo el mandato de los Estados miembros de la UfM: El desarrollo empresarial; la educación superior y la investigación; los asuntos sociales y civiles; la energía y la acción por el clima; el transporte y el desarrollo urbano; y finalmente, el agua y el medio ambiente. | The projects and initiatives of the Union for the Mediterranean are developed in six areas of activity following the mandate of the UfM Member States: Business development; higher education and research; social and civil affairs; energy and climate action; transportation and urban development; and finally, water and the environment. | 17, 1, 7, 9
