sentence|translation|sdg
Abierta la inscripción para la XXV edición del Trofeo Rectora.|Registration open for the XXV edition of the Rector's Trophy.|3
El vicerrectorado de Estudiantes, Cultura y Deportes ha abierto la inscripción para el Trofeo Rectora de este curso.|The Vice-Rectorate for Students, Culture and Sports has opened registration for this academic year's Rector's Trophy.|4
La competición tendrá lugar el próximo 11 de diciembre.|The competition will take place on December 11th.|3
Se disputarán 13 modalidades deportivas.|13 sports disciplines will be contested.|3
Pueden participar todos los miembros de la comunidad universitaria: Estudiantes, Personal Docente Investigador (PDI) y Personal Técnico, de Gestión y de Administración y Servicios (PTGAS).|All members of the university community can participate: Students, Teaching and Research Staff (PDI), and Technical, Management, and Administrative Services Staff (PTGAS).|4
Este año se convoca: ajedrez, baloncesto, baloncesto 3, balonmano, bádminton, fútbol 6, fútbol sala, pádel, rugby 7, tenis, tenis de mesa, voleibol y voley playa.|This year, the following are called: chess, basketball, 3x3 basketball, handball, badminton, 6-a-side football, futsal, paddle tennis, rugby 7, tennis, table tennis, volleyball, and beach volleyball.|3
Los ganadores de cada una de las modalidades deportivas de la XXV edición del Trofeo Rectora se enfrentarán a la Universidad de Murcia en el Trofeo Campus Mare Nostrum.|The winners of each of the sports disciplines of the XXV edition of the Rector's Trophy will compete against the University of Murcia in the Campus Mare Nostrum Trophy.|3
Las cuotas son 35 para los deportes de equipo; 20 para baloncesto 3x3; 10 para deportes de pareja y 5 para deportes individuales.|Fees are 35 for team sports; 20 for 3x3 basketball; 10 for pair sports, and 5 for individual sports.|3
La inscripción está abierta hasta el próximo 30 de noviembre.|Registration is open until November 30th.|3
