sentence | translation | sdg
La Universidad Politécnica de Cartagena está participando como miembro de la alianza EUt+ (European University of Technology) en la conferencia anual de la European Association for International Education "EAIE", que se celebra esta semana en Rotterdam, en Países Bajos.  | The Polytechnic University of Cartagena is participating as a member of the EUt+ alliance (European University of Technology) in the annual conference of the European Association for International Education "EAIE", being held this week in Rotterdam, Netherlands. | 4
En esta asamblea europea vinculada con la educación internacional se dan cita expositores de 95 países y más de 6.000 profesionales y académicos de 963 organizaciones. | This European assembly linked to international education brings together exhibitors from 95 countries and more than 6,000 professionals and academics from 963 organizations. | 4
El encuentro de EAIE, la organización de educación superior más importante de Europa, permite fomentar los encuentros e intercambios entre las instituciones educativas de todo el mundo. | The meeting of EAIE, the most important organization of higher education in Europe, allows to promote encounters and exchanges between educational institutions worldwide. | 4
Durante el evento se realizan simultáneamente workshops, conferencias, reuniones de trabajo entre universidades. | During the event, workshops, conferences, and work meetings between universities are held simultaneously. | 4
Cada año se organiza en una ciudad europea diferente.  | Each year it is organized in a different European city. | 4
