sentence | translation | sdg
El Servicio de Atención a Estudiantes de la UPCT ha actualizado su Guía informativa para alumnado de nuevo ingreso | The Student Care Service of the UPCT has updated its informative guide for new incoming students | 
para que quienes comiencen el próximo curso estudios oficiales en la Politécnica de Cartagena sepan cómo acceder al Campus Virtual | so that those who start official studies at the Polytechnic University of Cartagena next term know how to access the Virtual Campus | 
cómo revisar el correo electrónico o cómo conocer los horarios y aulas de las clases que comenzarán en septiembre | how to check email or how to know the schedules and classrooms of the classes that will start in September | 
También hay enlaces al calendario académico, que marca que el primer cuatrimestre del curso 2023-24 comenzará el 4 de septiembre y finalizará el 22 de diciembre | There are also links to the academic calendar, which indicates that the first semester of the 2023-24 academic year will start on September 4 and end on December 22 | 
Los másteres oficiales cuentan con calendario específico | Official master's degrees have a specific calendar | 
Otro acceso de interés es al Tour Virtual por los edificios de la UPCT | Another interesting access is the Virtual Tour of the UPCT buildings | 
La Guía también informa de cómo conseguir las nuevas tarjetas universitarias inteligentes | The guide also explains how to obtain the new smart university cards | 
sobre los diversos servicios que ofrece la UPCT, así como sobre cómo se organizan los estudios y otras inquietudes típicas de nuevos estudiantes | about the various services offered by the UPCT, as well as how studies are organized and other typical concerns of new students |
