sentence | translation | sdg
La cátedra de Empresa Familiar Mare Nostrum premia con 300 euros al mejor Trabajo Fin de Estudios, de grado o de máster, que trate cuestiones relacionadas con la empresa familiar y las pymes (pequeñas y medianas empresas). | The Mare Nostrum Family Business Chair awards 300 euros to the best Final Project work, at the undergraduate or master's level, dealing with issues related to family businesses and SMEs (small and medium enterprises). | 8
La cuarta edición de estos premios valora también los temas vinculados a sucesión, objetivos y estrategias, órganos de gobierno, incorporación de familiares, relación con los grupos de interés, entre otros. | The fourth edition of these awards also values topics related to succession, objectives and strategies, governance bodies, family member involvement, relationship with stakeholders, among others. | 8
También se valorarán trabajos que aborden de manera original y realista el análisis y recomendaciones de cuestiones que puedan ser de interés para las pymes, según las bases de la convocatoria. | Works that address in an original and realistic way the analysis and recommendations of issues that may be of interest to SMEs, according to the call's guidelines, will also be valued. | 8
El jurado podrá conceder también otros trabajos con un accésit. | The jury may also award other works with a special mention. | 8
Los autores recibirán un diploma acreditativo. | The authors will receive an accreditation diploma. | 8
La convocatoria está abierta hasta el próximo 30 de septiembre. | The call is open until September 30th. | 8
