sentence | translation | sdg
Los estudiantes de la UPCT reciben entrenamiento para aprender a hablar en público. | Students at UPCT receive training to learn public speaking. | 4
El Servicio Integral de Prácticas y Empleo ha realizado este jueves un training en el que los alumnos han tenido la oportunidad de participar en una especie de gimnasio de comunicación para hacer buenas exposiciones en público. | The Comprehensive Service for Internships and Employment conducted a training session on Thursday where students had the opportunity to participate in a communication gym to give effective public presentations. | 8
Mediante juegos y dinámicas Javier Soto, testó a los asistentes desde el primer momento. | Through games and dynamics, Javier Soto engaged the attendees right from the start. | 4
Les hizo salir de su zona de confort y experimentar los aspectos básicos que hay que tener en cuenta cada vez que una persona habla en público. | He made them step out of their comfort zone and experience the basic aspects that need to be considered every time a person speaks publicly. | 4
Por ejemplo, para afrontar el miedo hay que dar el primer paso; no bloquearse al cometer un error y seguir hablando, incluso hacer una broma sobre ello. | For example, to face fear, one must take the first step; not get blocked by making a mistake and keep speaking, even making a joke about it. | 3
Javier Soto ha impartido diferentes talleres a los estudiantes de la UPCT para entrenarles en liderazgo o gestión de equipos, estrategias todas ellas encaminadas a aumentar las posibilidades en la búsqueda de empleo y desarrollo profesional. | Javier Soto has conducted various workshops for UPCT students to train them in leadership or team management, all strategies aimed at increasing opportunities in job search and professional development. | 4, 8
