sentence|translation|sdg
Cartagena acogerá este jueves y viernes el congreso Tankbank 2017, un evento internacional que se celebra anualmente con el objetivo de generar contactos empresariales, y en el que participan las principales compañías de gestión de terminales químicas y petroquímicas, puertos europeos y fabricantes de tanques de almacenaje, entre otras.|Cartagena will host the Tankbank 2017 congress this Thursday and Friday, an international event held annually with the aim of creating business contacts, involving the main companies in the management of chemical and petrochemical terminals, European ports, and storage tank manufacturers, among others.|8
La consultora internacional TankBank ha escogido a Cartagena para la celebración de su 15º encuentro anual dadas las grandes posibilidades y servicios que ofrece el Puerto  para la industria.|The international consultancy TankBank has chosen Cartagena for the celebration of its 15th annual meeting due to the great possibilities and services offered by the Port for the industry.|9
El Puerto de Cartagena, en colaboración con la consultora internacional TankBank, acogerá un congreso diseñado para resaltar el potencial del Puerto de Cartagena y del Valle de Escombreras a una audiencia internacional y alentar a nuevas industrias a invertir en la zona.|The Port of Cartagena, in collaboration with the international consultancy TankBank, will host a congress designed to highlight the potential of the Port of Cartagena and the Escombreras Valley to an international audience and encourage new industries to invest in the area.|9
La cita será también un escaparate para las empresas que conforman la comunidad portuaria, que expondrán su experiencia tanto como proveedoras de servicios como usuarias de los mismos, en el que está considerado como el principal polo energético español.|The event will also be a showcase for the companies that make up the port community, which will showcase their experience both as service providers and as users of the services, in what is considered the main Spanish energy hub.|9
Los organizadores del evento, y la Región de Murcia como anfitriona, esperan congregar a representantes de un centenar de empresas internacionales, las más importantes del sector de la industria química que precisan del espacio y los servicios logísticos necesarios para desarrollar su actividad en las condiciones más ventajosas y competitivas.|The event organizers, along with the Region of Murcia as the host, expect to bring together representatives from a hundred international companies, the most important in the chemical industry sector that require the necessary space and logistical services to develop their activity under the most advantageous and competitive conditions.|9
El programa abarca un repaso al volumen de transporte de graneles líquidos que se mueve a través del Puerto de Cartagena y se detendrá en casos de éxito como el de Repsol, que protagonizó la inversión industrial más grande de España, Enagás o Ilboc.|The program covers a review of the volume of liquid bulk transport that moves through the Port of Cartagena and will delve into success stories such as Repsol, which led the largest industrial investment in Spain, Enagás, or Ilboc.|9
Más información en http://events.tankbank.com.sg/programme/|More information at http://events.tankbank.com.sg/programme/|9
