sentence | translation | sdg
La Escuela de Ingeniería Industrial de la UPCT celebra este miércoles la undécima edición de su jornadas de asociaciones y equipos de competición | The School of Industrial Engineering of UPCT celebrates this Wednesday the eleventh edition of its associations and competition teams days. | 4
en la que muestra a los nuevos estudiantes de la ETSII las posibilidades que tienen de participar en sus proyectos y concursos internacionales de ingeniería | in which it shows the new students of the ETSII the possibilities they have to participate in their engineering projects and international competitions. | 4
Los alumnos interesados en incorporarse a alguno de estos equipos de competición y asociaciones tecnológicas tendrán la oportunidad de contactar con los miembros de estas iniciativas y participar en los procesos de selección de nuevos los  integrantes para este curso académico | Students interested in joining any of these competition teams and technological associations will have the opportunity to contact the members of these initiatives and participate in the selection processes for new members for this academic year. | 4
La  jornada tendrá lugar  de 10:30-12:30  horas y 16:30-18:30 horas, en el Patio de Levante de la Escuela de Industriales, en el campus Muralla del Mar | The event will take place from 10:30-12:30 hours and 16:30-18:30 hours, at the Levante Patio of the School of Industrial Engineering, on the Muralla del Mar campus. | 4
La asistencia es libre | Attendance is free. | 3
Está abierta a la comunidad universitaria y público en general | It is open to the university community and the general public. | 4
