sentence | translation | sdg
Profesionales de diversos sectores de la Ingeniería Naval participan esta tarde en la jornada sobre salidas profesionales que se realizará de 17:30 a 19:00 horas en la Escuela Técnica Superior de Ingeniería Naval y Oceánica (ETSINO), ubicada en el campus Alfonso XIII. | Professionals from various sectors of Naval Engineering participate this afternoon in the session on professional opportunities that will take place from 17:30 to 19:00 at the Higher Technical School of Naval and Oceanic Engineering (ETSINO), located on the Alfonso XIII campus. | 9
En la jornada, que comienza a las 17:30 horas, se presentará el Servicio de Orientación Profesional de Ingenieros Navales (SOPIN) y las salidas laborales. | In the session, which begins at 17:30, the Professional Guidance Service for Naval Engineers (SOPIN) and job opportunities will be presented. | 8
La jornada finalizará con una mesa redonda sobre diferentes perfiles profesionales de los ingenieros navales, en la que se analizarán los perfiles reclamados por las empresas, las actividades de estos ingenieros, entre otros temas. | The session will end with a roundtable discussion on different professional profiles of naval engineers, analyzing the profiles demanded by companies, the activities of these engineers, among other topics. | 8
La Escuela de Navales de la UPCT imparte el grado en Arquitectura Naval e Ingeniería de Sistemas Marinos que incluye la especialidad de Arquitectura Naval y la de Propulsión y Servicios del Buque. | The Naval School of UPCT offers a degree in Naval Architecture and Marine Systems Engineering which includes specializations in Naval Architecture and Ship Propulsion and Systems. | 4
También ofrece el máster en Ingeniería Naval y Oceánica. | It also offers a master's degree in Naval and Oceanic Engineering. | 4
El grado en Arquitectura naval e Ingeniería de Sistemas Marinos de la UPCT es pionero en España. | The degree in Naval Architecture and Marine Systems Engineering at UPCT is a pioneer in Spain. | 4
El 45,41% de los estudiantes matriculados proceden de fuera de la Región. | 45.41% of the enrolled students come from outside the Region. | 4
Permite a los graduados trabajar en el diseño, construcción, mantenimiento, reparación e inspección técnica de buques. | It allows graduates to work in the design, construction, maintenance, repair, and technical inspection of ships. | 4
La Escuela cuenta con el buque Ciudad de Cartagena como aula/taller de prácticas flotante. | The School has the ship "City of Cartagena" as a floating practice workshop. | 4
