sentence | translation | sdg
La asociación MedCruise, que engloba a los principales puertos de cruceros del Mediterráneo, ha celebrado su 51 Asamblea General en la ciudad francesa de Toulon, donde se ha debatido sobre los últimos avances del sector crucerista. | The MedCruise association, which includes the main cruise ports in the Mediterranean, has held its 51st General Assembly in the French city of Toulon, where the latest advances in the cruise sector have been discussed. | 9
En la misma línea de anteriores eventos de MedCruise, todos los asociados y miembros han tenido la ocasión de hablar del desarrollo y oportunidades en el Mediterráneo, además de mantener reuniones B2B y talleres interactivos con ejecutivos de las empresas cruceristas. | In the same line as previous MedCruise events, all associates and members have had the opportunity to discuss development and opportunities in the Mediterranean, as well as to hold B2B meetings and interactive workshops with executives from cruise companies. | 9
El Puerto de Cartagena, miembro de la asociación desde hace años, asiste a este evento aprovechando la asistencia de los principales operadores mundiales a esta asamblea, y ha mantenido reuniones con las navieras Royal Princess,Celestyal, MSC, Royal Caribbean, HollandAmerica, Compgnie du Ponant y Silversea. | The Port of Cartagena, a member of the association for years, attends this event taking advantage of the presence of the main global operators at this assembly, and has held meetings with the cruise lines Royal Princess, Celestyal, MSC, Royal Caribbean, Holland America, Compgnie du Ponant, and Silversea. | 9
En esta Asamblea se llevó a cabo la elección del presidente del Consejo de dirección, formado por 12 puertos miembros de la asociación y 160 miembros y asociados que se han dado cita junto a 14 ejecutivos de navieras europeas y estadounidenses. | The election of the President of the Board of Directors was carried out at this Assembly, made up of 12 member ports of the association and 160 members and associates who met together with 14 executives from European and American cruise lines. | 9
El cargo ha recaído en Airam Díaz Pastor, director Comercial del Puerto de Tenerife, quien sucede al presidente de la Autoridad Portuaria de Durbrovnik, Kristijan Pavic. | The position has been awarded to Airam Díaz Pastor, Commercial Director of the Port of Tenerife, who succeeds the President of the Port Authority of Dubrovnik, Kristijan Pavic. | 9
Para el director de Desarrollo de Negocio de la Autoridad Portuaria de Cartagena, Fernando Muñoz, esta cita supone la posibilidad de continuar en la línea iniciada hace años en el Puerto de Cartagena incluyendo entre sus líneas estratégicas el sector cruceros, y que han posicionado a este puerto en el octavo de España, con un crecimiento interanual del 20% tanto en pasajeros como en buques. | For the Business Development Director of the Port Authority of Cartagena, Fernando Muñoz, this meeting represents the opportunity to continue the path started years ago in the Port of Cartagena, including cruise sector among its strategic lines, which has positioned this port as the eighth in Spain, with a yearly growth of 20% in both passengers and ships. | 9
Medcruise, que actualmente cuenta con 69 miembros, se creó el 11 de junio 1996 en Roma para promover la industria de cruceros en el Mediterráneo y ayudar a sus miembros proporcionando redes y oportunidades de desarrollo promocional y profesional. | MedCruise, which currently has 69 members, was created on June 11, 1996 in Rome to promote the cruise industry in the Mediterranean and help its members by providing networks and opportunities for promotional and professional development. | 9
