sentence | translation | sdg
Las personas de la comunidad universitaria que tienen menos de 60 años pueden vacunarse contra la virus de la gripe hasta el próximo martes, en el Servicio de Prevención de Riesgos Laborales, ubicado en la segunda planta del edificio ELDI. | People from the university community under 60 years old can get vaccinated against the flu virus until next Tuesday, at the Occupational Risk Prevention Service, located on the second floor of the ELDI building. | 3
También está prevista la administración frente a Covid-19 para quienes presenten alguna condición de riesgo. | Administration against Covid-19 is also planned for those with risk conditions. | 3
Las personas interesadas podrán vacunarse los días 14,15,18 y 19 de diciembre tras inscribirse en el portal de servicios. | Interested individuals can get vaccinated on the 14th, 15th, 18th, and 19th of December after registering on the service portal. | 3
El lunes 18 habrá vacunaciones en horario de tarde. | On Monday the 18th, vaccinations will be available in the afternoon. | 3
Esta vacunación está recomendada especialmente para personal sensible, como pueden ser diabéticos, pacientes con patología cardiovascular, personas con dolencias neurológicas activas o personas con dolencias pulmonares crónicas, recuerdan desde el Servicio de Prevención, así como que se ha evidenciado que la mortalidad de los pacientes con COVID-19 se duplica cuando también están infectados por el virus de la gripe. | This vaccination is recommended especially for vulnerable individuals, such as diabetics, patients with cardiovascular pathologies, individuals with active neurological ailments, or those with chronic pulmonary conditions, as highlighted by the Prevention Service, also noting that the mortality of COVID-19 patients doubles when also infected with the flu virus. | 3
En la última campaña se vacunaron 300 miembros de la comunidad universitaria, entre PDI y PTGAS. | In the last campaign, 300 members of the university community, including teaching and administrative staff, were vaccinated. | 3
