sentence | translation | sdg
Cinco expertos de reconocido prestigio integran el nuevo comité de evaluación externa del Instituto de Biotecnología Vegetal (IBV) de la UPCT, aprobado hoy. | Five experts of recognized prestige integrate the new external evaluation committee of the Plant Biotechnology Institute (IBV) of the UPCT, approved today. | 4
Se trata de un nuevo órgano independiente y de carácter consultivo sobre materias relacionadas con la docencia, la investigación y la transferencia tecnológica. | It is a new independent and advisory body on matters related to teaching, research, and technology transfer. | 4
Lorenzo Zacarías, Mara Santalla, Iraida Saavedra, Juan Ferré e Ignacio Valladares forman el equipo evaluador, aprobado en Consejo de Gobierno. | Lorenzo Zacarías, Mara Santalla, Iraida Saavedra, Juan Ferré, and Ignacio Valladares form the evaluation team, approved by the Government Council. | 4
Lorenzo Zacarías es profesor de investigación del Consejo Superior de Investigaciones Científicas (CSIC) en el Instituto de Agroquímica y Tecnología de Alimento (IATA). | Lorenzo Zacarías is a research professor at the Higher Council for Scientific Research (CSIC) at the Institute of Agrochemistry and Food Technology (IATA). | 4
Mara Santalla desarrolla su labor investigadora en la Agencia Estatal Del Consejo Superior De Investigaciones Científicas, Misión Biológica De Galicia, y miembro del grupo de Genética Del Desarrollo De Plantas. | Mara Santalla carries out her research work at the State Agency of the Higher Council for Scientific Research, Biological Mission of Galicia, and is a member of the Plant Development Genetics group. | 4
Iraida Amaya es investigadora del área de Mejora Vegetal y Biotecnología del Centro IFAPA (Instituto Andaluz de Investigación y Formación Agraria, Pesquera, Alimentaria y de Producción Ecológica) de Málaga. | Iraida Amaya is a researcher in the area of Plant Improvement and Biotechnology at the IFAPA Center (Andalusian Institute of Agricultural, Fisheries, Food, and Ecological Production Research and Training) in Malaga. | 4
Juan Ferre dirige la Estructura de Investigación Interdisciplinar en Biotecnología y Biomedicina (BIOTECMED) y profesor del departamento de Genética de la Universidad de Valencia. | Juan Ferre directs the Interdisciplinary Research Structure in Biotechnology and Biomedicine (BIOTECMED) and is a professor in the Genetics Department at the University of Valencia. | 4
Fernando Valladares, premio Jaume I 2021 a la Protección del Medio Ambiente, en la actualidad dirige el grupo de Ecología y Cambio Global en el Museo Nacional de Ciencias Naturales y es profesor asociado de la Universidad Rey Juan Carlos de Madrid. | Fernando Valladares, 2021 Jaume I Award for Environmental Protection, currently directs the Ecology and Global Change group at the National Museum of Natural Sciences and is an associate professor at the Rey Juan Carlos University of Madrid. | 4
El IBV se encuentra en una etapa de expansión en todos los niveles debido a la investigación y la transferencia de tecnología que lleva a cabo con el sector privado y público, resalta el director, el catedrático Marcos Egea. | The IBV is in an expansion stage at all levels due to the research and technology transfer it carries out with the private and public sectors, highlights the director, Professor Marcos Egea. | 4
