sentence | translation | sdg
El Consejo de Gobierno, a propuesta de la Consejería de Medio Ambiente, Mar Menor, Universidades e Investigación, ha autorizado hoy la firma de los Contratos-Programa con las universidades públicas de la Región de Murcia, a los que la Comunidad destina un total de 7.075.000 euros. | The Government Council, at the proposal of the Ministry of Environment, Mar Menor, Universities, and Research, has authorized today the signing of Program Contracts with the public universities of the Region of Murcia, to which the Community allocates a total of 7,075,000 euros. | 4
En concreto, la Universidad de Murcia (UMU) recibirá 5.700.000 euros, mientras que 1.375.000 de euros corresponden a la Universidad Politécnica de Cartagena (UPCT). | Specifically, the University of Murcia (UMU) will receive 5,700,000 euros, while 1,375,000 euros correspond to the Polytechnic University of Cartagena (UPCT). | 4
Se trata de una financiación condicionada al cumplimiento de objetivos en la docencia, en la investigación, en la transferencia de resultados, en la gestión eficiente, en la internacionalización y en otros parámetros para mejorar el sistema público universitario y hacerlo más competitivo, atrayente y posicionarlo a nivel internacional. | This is funding conditioned on achieving objectives in teaching, research, transfer of results, efficient management, internationalization, and other parameters to improve the public university system and make it more competitive, attractive, and position it internationally. | 4
Los Contratos-Programa apuestan por la internacionalización de las universidades públicas e inciden en la Estrategia de Especialización inteligente de la Comunidad (RIS4MUR); la captación de recursos externos para la investigación o la internacionalización de la productividad científica de las dos universidades públicas; y la transferencia de resultados o la empleabilidad de sus egresados, el emprendimiento, la colaboración universidad-empresas y el desarrollo sostenible. | The Program Contracts bet on the internationalization of public universities and have an impact on the Smart Specialization Strategy of the Community (RIS4MUR); attracting external resources for research or the internationalization of scientific productivity of the two public universities; and the transfer of results or employability of their graduates, entrepreneurship, university-enterprise collaboration, and sustainable development. | 4
Los dos Contratos-Programa mantienen cuatro líneas de actuación: la mejora de la formación para una universidad más competitiva; por una investigación de excelencia que traspasa fronteras; la valorización transferencia del conocimiento y empleabilidad; y la gestión eficiente, sostenible y socialmente responsable. | The two Program Contracts maintain four lines of action: improving training for a more competitive university; for excellent research that crosses borders; the valuation of knowledge transfer and employability; and efficient, sustainable, and socially responsible management. | 4
Otros objetivos estratégicos son el bilingüismo, la apuesta por la calidad, la reducción del profesorado asociado o el desarrollo de contenidos para la enseñanza online. | Other strategic objectives include bilingualism, a commitment to quality, reducing associated teaching staff, or developing content for online education. | 4, 8, 9
