sentence | translation | sdg
La profesora del departamento de Arquitectura y Tecnología de la Edificación, Josefina García León, impartió este viernes una conferencia junto al historiador Miguel Ángel Ríos, sobre "Los misterios de San Diego: El antiguo convento franciscano". | Professor from the Department of Architecture and Building Technology, Josefina García León, gave a lecture this Friday along with historian Miguel Ángel Ríos, on "The mysteries of San Diego: The ancient Franciscan convent." | 4
Esta actividad se enmarca en el ciclo Los viernes de San Diego. | This activity is part of the Fridays of San Diego cycle. | 4
En la Iglesia, además de impartirse la conferencia, se realizó una exposición con los trabajos que los alumnos del master de Patrimonio Arquitectónico de la ETSAE han realizado del templo. | In the Church, in addition to the lecture, an exhibition was held with the work done by the students of the Master's in Architectural Heritage at the ETSAE. | 4
El tema principal de la muestra es el trabajo multidisciplinar y la investigación aplicada, ya que en este estudio participan dos grupos de investigación, por una parte el grupo TAG de la ETSAE (Escuela Técnica Superior de Arquitectura y Edificación) y el grupo de GEODE de ETCM. | The main theme of the exhibition is multidisciplinary work and applied research, as this study involves two research groups, on one hand, the TAG group of the ETSAE (Higher Technical School of Architecture and Building) and the GEODE group of ETCM. | 4
Tanto para documentar huecos en el templo como para hacer un estudio geofísico mediante georradar de los paramentos verticales. | Both to document voids in the temple and to conduct a geophysical study using ground-penetrating radar on the vertical walls. | 4
Es decir, mediante la documentación del patrimonio se han detectado huecos en los paramentos verticales de la iglesia y con la geofísica se ha medido lo que hay en ellos sin afectar al patrimonio arquitectónico, según explica García León, investigadora principal del grupo Thermal Analysis And Geomatics. | In other words, through the documentation of heritage, voids have been detected in the vertical walls of the church, and with geophysics, what is inside them has been measured without affecting the architectural heritage, as explained by García León, principal investigator of the Thermal Analysis and Geomatics group. | 4
