sentence | translation | sdg
La profesora del área de Geodinámica Interna de la UPCT, Marisol Manzano, interviene este miércoles en el programa educativo La aventura del saber, en La 2 de TVE, perteneciente a la serie Universo Sostenible, junto con profesores e investigadores de seis universidades españolas. | The professor in the area of Internal Geodynamics from UPCT, Marisol Manzano, participates this Wednesday in the educational program "La aventura del saber" on La 2 de TVE, belonging to the series "Universo Sostenible," alongside professors and researchers from six Spanish universities. | 4
Dentro del tema: ¿Cómo afecta a la vegetación la calidad del agua?, Manzano habla sobre los aspectos principales de las aguas subterráneas; qué son y cómo se relacionan con otras partes del ciclo hídrico; cuáles son los usos principales en España y el mundo; cómo contribuyen al progreso y al bienestar de los seres humanos, especialmente, en zonas de clima semiárido, como la nuestra; cómo afecta la sobreexplotación de las aguas subterráneas y su contaminación a los ríos lagos, humedales y bosques vinculados a ellas; entre otras cuestiones. | Within the topic: How does water quality affect vegetation?, Manzano discusses the main aspects of groundwater; what they are and how they relate to other parts of the water cycle; what are the main uses in Spain and the world; how they contribute to the progress and well-being of humans, especially in semi-arid climates like ours; how overexploitation and contamination of groundwater affect rivers, lakes, wetlands, and forests linked to them; among other issues. | 6
Se trata del cuarto capítulo de la sexta temporada de Universo Sostenible, que arrancó a primeros de mayo y, en total, tiene nueve capítulos. | This is the fourth chapter of the sixth season of "Universo Sostenible," which started in early May and has a total of nine chapters. | 4
El personal investigador de la Universidad Politécnica de Cartagena participa en esta serie coproducida por CRUE, la Conferencia de Rectores de las Universidades Españolas, y capitaneada por la Universitat de València. | The research staff of the Universidad Politécnica de Cartagena participates in this series co-produced by CRUE, the Conference of Rectors of Spanish Universities, and led by the Universitat de València. | 4
Los temas que se abordan son de interés general, gran impacto social y objeto de conocimiento científico. | The topics addressed are of general interest, have a significant social impact, and are the subject of scientific knowledge. | 4
En esta nueva etapa, la temática gira en torno a las células madre; el cambio climático; las enfermedades neurodegenerativas; los efectos de la deforestación en la biodiversidad; las tecnologías 5G; el impacto del azúcar en la salud; las erupciones volcánicas; la inteligencia de las aves; la vegetación en la calidad del agua; y la posidonia oceánica. | In this new stage, the themes revolve around stem cells; climate change; neurodegenerative diseases; the effects of deforestation on biodiversity; 5G technologies; the impact of sugar on health; volcanic eruptions; bird intelligence; vegetation in water quality; and oceanic posidonia. | 4, 6
