sentence | translation | sdg
La Red Iberoamericana de Geotermia Somera se reúne por primera vez en España, desde hoy en la Universidad Politécnica de Cartagena, para compartir las ventajas de utilizar la disparidad de temperaturas entre la superficie y el subsuelo para climatizar todo tipo de construcciones tanto en climas fríos como cálidos. | The Ibero-American Shallow Geothermal Network meets for the first time in Spain, starting today at the Polytechnic University of Cartagena, to share the advantages of using the temperature disparity between the surface and the subsurface to climate-control all types of buildings in both cold and warm climates. | 7
La clave son las temperaturas extremas. Generalmente se ha usado la geotermia en países muy fríos para calentar edificios, pero en México la estamos utilizando para enfriar y ahorrar hasta un 50% en aire acondicionado, ha explicado el experto energético de la Universidad Nacional Autónoma de México David Morillón Gálvez, quien ha impartido una conferencia sobre arquitectura bioclimática. | "The key lies in extreme temperatures. Geothermal energy has generally been used in very cold countries to heat buildings, but in Mexico we are using it to cool down and save up to 50% on air conditioning," explained the energy expert from the National Autonomous University of Mexico, David Morillón Gálvez, who gave a lecture on bioclimatic architecture. | 13
La geotermia es una alternativa sostenible cuando el uso de las condiciones medioambientales, como la radiación solar o el viento, no es suficiente para lograr temperaturas de confort para viviendas, edificios, industrias o granjas, subraya el ingeniero mexicano, que está participando en proyectos que utilizan la energía geotérmica en el norte desértico de su país, con la técnica de pozos canadienses, de escasa profundidad, y mediante las llamadas pilas energéticas usando los pilotes de cimentación que se requieren en las edificaciones en Ciudad de México. | "Geothermal energy is a sustainable alternative when the use of environmental conditions such as solar radiation or wind is not enough to achieve comfortable temperatures for homes, buildings, industries, or farms," stresses the Mexican engineer, who is involved in projects using geothermal energy in the desert north of his country, with the technique of shallow wells, and through energy piles using the foundation piles required in buildings in Mexico City. | 7
Aprovechar los trabajos de perforación durante la construcción abarata la instalación de bombas de calor geotérmico, remarca. | "Taking advantage of drilling work during construction reduces the cost of installing geothermal heat pumps," he points out. | 9
La Región de Murcia tiene suficiente capacidad geotérmica para abastecer a la demanda residencial de climatización, según la tesis en la UPCT de Adela Ramos, quien mapeó el potencial de este recurso renovable que utiliza el subsuelo y sus temperaturas estables para, mediante intercambiadores de calor, climatizar edificaciones. | The Region of Murcia has enough geothermal capacity to supply residential demand for climate control, according to the thesis at the UPCT by Adela Ramos, who mapped the potential of this renewable resource that uses the subsurface and its stable temperatures to climate-control buildings through heat exchangers. | 7
"Es una fuente renovable y ubicua al alcance de todos, que utiliza el subsuelo como sumidero energético", explica la coordinadora de la Red Iberoamericana de Geotermia Somera, Mar Alcaraz, investigadora del departamento de Ingeniería Minera y Civil de la UPCT. | "It is a renewable and ubiquitous source available to all, using the subsurface as an energy sink," explains Mar Alcaraz, coordinator of the Ibero-American Shallow Geothermal Network, and researcher in the Department of Mining and Civil Engineering at the UPCT. | 7
Otro de los investigadores que ha acudido a la Escuela de Caminos y Minas, el chileno Diego José Aravena Noemi, del Centro de Excelencia en Geotermia de Los Andes, ha explicado la utilización de la geotecnia para climatizar viviendas en zonas de gran altitud, así como la utilización de fuentes termales para calentar invernaderos. | Another researcher who has attended the School of Engineering and Mines, the Chilean Diego José Aravena Noemi, from the Center of Excellence in Geothermal Energy of Los Andes, has explained the use of geotechnics to climate-control homes in high-altitude areas, as well as the use of thermal springs to heat greenhouses. | 7
Participan en el encuentro investigadores de seis países latinoamericanos y de centros de investigación de Cataluña y Baleares, así como de la Politécnica de Cartagena. | Researchers from six Latin American countries, research centers in Catalonia and the Balearic Islands, as well as the Polytechnic University of Cartagena, are participating in the meeting. | 7
El evento está financiado por la Consejería de Medio Ambiente, Mar Menor, Universidades e Investigación a través de la Fundación Séneca - Agencia de Ciencia y Tecnología de la Región de Murcia, con cargo al Programa Regional de Movilidad, Colaboración e Intercambio de Conocimiento 'Jiménez de la Espada'. | The event is funded by the Department of Environment, Mar Menor, Universities, and Research through the Séneca Foundation - Science and Technology Agency of the Region of Murcia, under the Regional Program for Mobility, Collaboration, and Exchange of Knowledge 'Jiménez de la Espada'. | 17
