sentence | translation | sdg
La Escuela Técnica Superior de Ingeniería Agronómica (ETSIA) ha organizado un curso gratuito de 'Mejora de las Habilidades Lingüísticas en Inglés' de 12 horas de duración. | The School of Agronomic Engineering (ETSIA) has organized a free course on 'Improving Language Skills in English' lasting 12 hours. | 4
Está enfocado a  estudiantes que tengan previsto realizar un programa de movilidad Erasmus o aquellos que vayan a cursar asignaturas en inglés. | It is aimed at students who plan to participate in an Erasmus mobility program or those who will take subjects in English. | 4
Durante el curso, los alumnos trabajarán la comprensión de textos técnicos y la preparación de presentaciones orales e informes escritos en inglés, informa la subdirectora de Relaciones Internacionales, Asunción Iguaz. | During the course, students will work on understanding technical texts and preparing oral presentations and written reports in English, as reported by the Deputy Director of International Relations, Asunción Iguaz. | 4
El curso es gratuito. | The course is free. | 4
Las clases se darán en la ETSIA. durante octubre y noviembre. | Classes will be held at the ETSIA during October and November. | 4
El horario será convenir entre la profesora y los alumnos. | The schedule will be agreed upon by the teacher and the students. | 4
Esta actividad está dirigida prioritariamente a alumnos de Agrónomos, pero está abierta a cualquier estudiante de la UPCT. | This activity is primarily aimed at Agronomy students, but is open to any student at the UPCT. | 4
Los alumnos interesados deben enviar un mail a subdtor.relex@etsia.upct.es antes del 25 de septiembre. | Interested students must send an email to subdtor.relex@etsia.upct.es before September 25. | 4
