sentence | translation | sdg  
El programa de la UPCT Ingeniosanos ha iniciado esta mañana una nueva edición con el taller Matemáticas e ingeniería de forma lúdica | The UPCT program 'Ingeniosanos' has started a new edition this morning with the workshop 'Mathematics and engineering in a playful way' | 4  
llevado a cabo por el profesor de la UPCT Juan Carlos Trillo en las aulas hospitalarias de La Arriaxaca, en Murcia | conducted by UPCT professor Juan Carlos Trillo in the hospital classrooms of La Arriaxaca, in Murcia | 3  
Durante el curso 2023-24, investigadores y asociaciones estudiantiles de la UPCT impartirán talleres de divulgación científica y tecnológica en los hospitales de La Arriaxaca y del Santa Lucía | During the 2023-24 academic year, researchers and student associations from UPCT will conduct workshops on scientific and technological dissemination in La Arriaxaca and Santa Lucía hospitals | 4, 9  
El próximo lunes, 30 de octubre, tendrá lugar el siguiente: Experiencias de realidad inmersiva, que será desarrollado por el personal del Laboratorio de Fabricación Digital (FabLab) de la UPCT en el Santa Lucía | Next Monday, October 30, the following will take place: 'Immersive reality experiences', which will be developed by UPCT's Digital Manufacturing Laboratory (FabLab) staff at Santa Lucía | 4  
UPCT-Ingeniosanos es una iniciativa de la Unidad de Cultura Científica y de la Innovación (UCC+i) de la UPCT que surgió en 2016 como programa educativo y que se realiza junto al Equipo de Atención Educativa Hospitalaria y Domiciliaria (EAEHD) de la Consejería de Educación de la Región de Murcia | UPCT-Ingeniosanos is an initiative of the Scientific Culture and Innovation Unit (UCC+i) of UPCT that emerged in 2016 as an educational program and is carried out together with the Hospital and Home Educational Care Team (EAEHD) of the Ministry of Education of the Region of Murcia | 4  
Está destinado a niños y adolescentes en situación de enfermedad y el objetivo es acercar, presentar, interactuar y construir con la ciencia y la tecnología en las aulas hospitalarias de la Región | It is aimed at children and adolescents in a situation of illness, and the objective is to bring, present, interact, and build with science and technology in hospital classrooms in the Region | 3, 4  
Esta iniciativa forma parte del programa de actividades de la UCC+i del curso 2023/2024, que cuenta con la colaboración de la Fundación Española para la Ciencia y la Tecnología - Ministerio de Ciencia e Innovación | This initiative is part of the UCC+i activities program for the 2023/2024 academic year, which has the collaboration of the Spanish Foundation for Science and Technology - Ministry of Science and Innovation | 4, 9
