sentence|translation|sdg
La Cátedra de Medio Ambiente Autoridad Portuaria de Cartagena-Campus Mare Nostrum ha lanzado una convocatoria para cubrir tres contratos de investigación.|The Chair of Environment of the Port Authority of Cartagena-Campus Mare Nostrum has launched a call to fill three research contracts.|9
Son siete los temas prioritarios desde el punto de vista medioambiental para el ámbito portuario de Cartagena: Red Natura 2000; Ruido subacuático y ruido ambiental; Contaminación marina; Gestión de residuos; Suelos contaminados; Biodiversidad y gestión responsable de especies y hábitats y Desarrollos tecnológicos relacionados con la difusión, comunicación o gestión de actuaciones ambientales.|There are seven priority topics from an environmental point of view for the port area of Cartagena: Natura 2000 Network; Underwater and environmental noise; Marine pollution; Waste management; Contaminated soils; Biodiversity and responsible management of species and habitats; and Technological developments related to the diffusion, communication, or management of environmental actions.|14
La convocatoria está dirigida a los  investigadores de la Universidad Politécnica de Cartagena y la Universidad de Murcia.|The call is aimed at researchers from the Polytechnic University of Cartagena and the University of Murcia.|4
Pueden contar con la colaboración de otras universidades, fundaciones, empresas y demás instituciones públicas y privadas que puedan contribuir al desarrollo del conocimiento en materias relacionadas con el medio ambiente en el entorno del Puerto de Cartagena.|They can count on the collaboration of other universities, foundations, companies, and other public and private institutions that can contribute to the development of knowledge in matters related to the environment in the area of the Port of Cartagena.|17
El plazo de presentación de las propuestas finaliza el 30 de noviembre, a las 14:00 horas.|The deadline for submitting proposals is November 30th, at 14:00 hours.|9
La Cátedra Interuniversitaria de Medio Ambiente Autoridad Portuaria de Cartagena - Campus Mare Nostrum tiene atribuidas, entre sus funciones, la de promover y realizar estudios e investigaciones multidisciplinares sobre materias relacionadas con el medio ambiente en el entorno del Puerto de Cartagena, que puedan ser aprovechables y explotables por la Autoridad Portuaria en beneficio de su buen desarrollo y gestión final.|The Interuniversity Chair of Environment of the Port Authority of Cartagena - Campus Mare Nostrum is assigned, among its functions, to promote and carry out multidisciplinary studies and research on matters related to the environment in the area of the Port of Cartagena, which can be useful and exploitable by the Port Authority for the benefit of its good development and final management.|9
