sentence | translation | sdg
Estudiantes de la asociación IEEE UPCT lograron la mejor posición entre los equipos españoles en el maratón de programación ('hackaton') IEEExtreme, que se celebró este fin de semana y en el que hubo casi 15.000 participantes. | Students from the IEEE UPCT association achieved the best position among the Spanish teams in the IEEExtreme programming marathon ('hackathon'), which took place this weekend with almost 15,000 participants. | 4
La prueba consistía en resolver sucesivamente problemas de programación y duró 24 horas. | The competition involved solving programming problems successively and lasted 24 hours. | 4
Los problemas son variados y pueden incluir temas como algoritmos, estructuras de datos, matemáticas, teoría de grafos, teoría de números o lógica entre otros. | The problems are varied and may include topics such as algorithms, data structures, mathematics, graph theory, number theory, or logic, among others. | 4
El objetivo del desafío es fomentar la creatividad, la colaboración y la resolución de problemas en un entorno competitivo. | The challenge's goal is to promote creativity, collaboration, and problems solving in a competitive environment. | 4
Por la UPCT participaron los estudiantes del grado en Ingeniería Electrónica Industrial y Automática Álvaro Navarro Jorquera, Dani Martínez Pedreño y Elías Aguilar Olsson, quien lo hizo desde Suecia, donde está de movilidad erasmus. | UPCT's Industrial Electronics and Automation Engineering degree students Álvaro Navarro Jorquera, Dani Martínez Pedreño, and Elías Aguilar Olsson participated, with Elías doing so from Sweden, where he is on an Erasmus mobility. | 4
La rama estudiantil en la UPCT de IEEE (Institute of Electrical and Electronics Engineers, la mayor organización profesional de ingenieros a nivel mundial) ya obtuvo el primer puesto a nivel nacional en la edición de 2020 de este concurso. | The student branch at UPCT of IEEE (Institute of Electrical and Electronics Engineers, the largest professional organization of engineers worldwide) already obtained the first place nationally in the 2020 edition of this competition. | 4
Los estudiantes de la Politécnica de Cartagena tienen la oportunidad de sumarse a esta asociación, que está en proceso de captación de miembros. | Students from the Polytechnic University of Cartagena have the opportunity to join this association, which is currently recruiting members. | 4
Se puede contactar con ella a través del correo electrónico sb.ieee@upct.es o en el perfil @ieeeupct de Instagram. | You can contact them via email at sb.ieee@upct.es or through the Instagram profile @ieeeupct. | 3
