sentence | translation | sdg
El Consejo de Administración de la Autoridad Portuaria de Cartagena ha aprobado esta mañana la autorización a la Cámara de Comercio, Industrial y Navegación de Cartagena para la transmisión por compraventa de la concesión administrativa de la que es titular a favor de la empresa Mercado del Puerto de Cartagena, S.L. para la instalación de un grastobar. | The Board of Directors of the Port Authority of Cartagena has approved this morning the authorization to the Chamber of Commerce, Industry and Navigation of Cartagena for the transmission by sale of the administrative concession of which it is the holder in favor of the company Mercado del Puerto de Cartagena, S.L. for the installation of a snack bar. | 9
Este proyecto se suma a la reforma del edificio comercial ubicado en el muelle Alfonso XII, aprobado el mes pasado por un importe de más de 1 millón de euros, lo que conllevará un cambio de imagen para la explanada, así como un aliciente para posibilitar la instalación de espacios de ocio y restauración, ya que se trata de la zona más próxima a la terminal de Cruceros, dando un mejor servicio a los turistas que visitan la ciudad. | This project adds to the reform of the commercial building located in the Alfonso XII pier, approved last month for an amount of more than 1 million euros, which will entail a change of image for the esplanade, as well as an incentive to enable the installation of leisure and dining spaces, as it is the area closest to the Cruise terminal, providing better service to tourists visiting the city. | 9
La actual concesión fue otorgada en diciembre de 2000 a la Cámara de Comercio de Cartagena para la construcción de su sede central, por un periodo de 30 años, a la que una vez presentada la documentación necesaria se subrogará Mercado del Puerto de Cartagena, S.L. | The current concession was granted in December 2000 to the Chamber of Commerce of Cartagena for the construction of its headquarters, for a period of 30 years, to which once the necessary documentation is submitted, Mercado del Puerto de Cartagena, S.L. will be subrogated. | 9
También se han aprobado la renovación de licencias a la Agrupación de Boteros y Amarradores del Puerto de Cartagena, por un periodo de 6 años, para la prestación de servicio portuario de amarre y desamarre de buques en el Puerto; y a Cartago Marpol para la prestación del servicio portuario de recepción de desechos generados por los buques. Ambas por caducidad y con entrada en vigor a partir del próximo 1 de enero, y por un periodo de 6 años. | Licenses have also been approved for the renewal of the Association of Boaters and Mooring Operators of the Port of Cartagena, for a period of 6 years, for the provision of port service of mooring and unmooring of ships at the Port; and to Cartago Marpol for the provision of the port service of receiving waste generated by the ships. Both due to expiration and with effect from January 1st, and for a period of 6 years. | 9
Además se ha acordado la prórroga de las licencias, adaptándolas a la normativa actual, para la prestación de servicios en el Puerto de Cartagena de manipulación de mercancías a las empresas habilitadas que los han solicitado, entre otras, a Ership S.A, Agencia Marítima Blázquez S.A., Bergé Marítima S.L., Terminal Marítima de Cartagena S.L.,y Daniel Gómez Servicios Portuarios S.L.. | Furthermore, the extension of licenses has been agreed upon, adapting them to current regulations, for the provision of services in the Port of Cartagena for handling goods to the authorized companies that have requested them, among others, to Ership S.A, Agencia Marítima Blázquez S.A., Bergé Marítima S.L., Terminal Marítima de Cartagena S.L., and Daniel Gómez Servicios Portuarios S.L.. | 9
A la reunión mantenida ha asistido en calidad de invitado el nuevo Delegado del Gobierno en la Región de Murcia, Francisco Bernabé, que ha agradecido la colaboración de todas la Comunidad Portuaria de los últimos ante la masiva llegada de pateras. | The meeting was attended as a guest by the new Government Delegate in the Region of Murcia, Francisco Bernabé, who thanked all the Port Community for their collaboration in the face of the massive arrival of small boats. | 16
