sentence | translation | sdg
Los responsables de los departamentos de Automatización y Recursos Humanos de la factoría de MTorres en Fuente Álamo han impartido este mediodía un seminario en el salón de grados de la Escuela de Industriales, en el marco de la asignatura Proyectos de Ingeniería que imparte Francisco Cavas, sobre las oportunidades laborales en la compañía para que los futuros egresados de la ETSII pongan en práctica sus conocimientos en proyectos reales de Ingeniería. | Managers of the Automation and Human Resources departments at the MTorres factory in Fuente Álamo have given a seminar at noon in the lecture hall of the School of Industrial Engineering, as part of the 'Engineering Projects' subject taught by Francisco Cavas, on job opportunities in the company for future graduates of the ETSII to apply their knowledge in real engineering projects. | 8
La charla del jefe de Automatización, Antonio Patricio Bernal Rodríguez, titulado en Ingeniería Electrónica y Automática por la UPCT, ha estado dirigida a estudiantes de los últimos grados que se imparten en la Escuela de Industriales y ha incluido información sobre la empresa MTorres y sus actuales proyectos y un ejemplo real, de una plataforma colaborativa de remachado para la industria aeronáutica, de las fases en que consiste un proyecto de Ingeniería: oferta, planificación, diseño y desarrollo, acopio y aprovisionamiento, montaje y puesta en marcha. | The talk by the head of Automation, Antonio Patricio Bernal Rodríguez, who holds a degree in Electronic and Automatic Engineering from the UPCT, was aimed at students in the final grades offered at the School of Industrial Engineering and included information about the company MTorres and its current projects, as well as a real example of a collaborative riveting platform for the aerospace industry, detailing the phases of an engineering project: proposal, planning, design and development, procurement and supply, assembly, and commissioning.  | 4
MTorres acaba de fichar a tres egresados de la UPCT y el 80% de sus contratos del último año han sido para incorporar ingenieros recién titulados, según ha explicado la jefa de Recursos Humanos, María Eugenia García Mateo. | MTorres has just hired three graduates from UPCT, and 80% of its contracts in the last year have been to hire newly graduated engineers, as explained by the Human Resources manager, María Eugenia García Mateo.  | 4
Buscamos jóvenes ingenieros formados en Diseño, Automatización, Electricidad e Ingeniería Industrial en su conjunto, que cuenten con un alto nivel de inglés y valoramos segundos idiomas, especialmente el alemán, ha explicado. | "We are looking for young engineers trained in Design, Automation, Electricity, and Industrial Engineering as a whole, who have a high level of English and we value second languages, especially German," she explained. | 4
La empresa enseña competencias técnicas a los recién titulados en programas de entrenamiento bajo la supervisión de empleados veteranos. | The company teaches technical skills to recent graduates in training programs under the supervision of veteran employees. | 4
La compañía ha renovado este año su cátedra en la UPCT, dirigida por Francisco Cavas, en el marco de la que se han realizado proyectos de I+D+i, se ha participado en convocatorias del CDTI y se ha realizado la tesis de Leandro Ruiz en régimen de doctorado industrial. | The company has renewed its chair at UPCT this year, led by Francisco Cavas, within which R&D projects have been conducted, participation in calls from CDTI has occurred, and the doctoral thesis of Leandro Ruiz has been carried out under industrial doctorate regime. | 4
"Hemos realizado actividades de divulgación científica, charlas formativas e impulsado la empleabilidad de los estudiantes con becas y prácticas en la empresa, así como con la realización de trabajos finales de grado y máster en la propia compañía", recuerda Cavas. | "We have carried out scientific dissemination activities, training sessions, and promoted the employability of students with scholarships and internships in the company, as well as by performing final degree and master's projects within the company," Cavas recalls. | 4
