sentence | translation | sdg  
Numerosos investigadores de la Universidad Politécnica de Cartagena imparten ponencias técnicas en la feria de tecnología agrícola Fame Innowa que se celebra desde este jueves y hasta el sábado en el Palacio de Ferias y Exposiciones de la Región de Murcia, ubicado en Torre Pacheco. | Many researchers from the Universidad Politécnica de Cartagena give technical presentations at the agricultural technology fair Fame Innowa, which runs from this Thursday until Saturday at the Palace of Fairs and Exhibitions of the Region of Murcia, located in Torre Pacheco. | 9    
En la jornada inaugural, centrada en la digitalización, interviene Lola Ojados explicando los desarrollos con realidad virtual para formación en el manejo de tractores y con captura de imagen para alertar de movimientos de riesgo ergonómico en poda de frutales. | In the opening day, focused on digitalization, Lola Ojados explains developments with virtual reality for training in tractor handling and image capture to alert of ergonomic risk movements in fruit tree pruning. | 9    
También este jueves hablan Francisco Alcón, sobre la productividad económica del agua de riego en contexto de escasez, y José Miguel Molina, respecto a digitalización, automatización y robótica en la agricultura. | Also this Thursday, Francisco Alcón speaks about the economic productivity of irrigation water in a context of scarcity, and José Miguel Molina discusses digitalization, automation, and robotics in agriculture. | 9    
El viernes 21 imparte una charla sobre biotecnología para plantas resistentes a las enfermedades la investigadora agrónoma Dina Cifuentes. | On Friday the 21st, agronomist researcher Dina Cifuentes gives a talk on biotechnology for disease-resistant plants. | 3    
Y el sábado lo harán Jesús Ochoa, sobre horticultura innovadora, y Francisco Javier Pérez de la Cruz, sobre el coste energético y medioambiental. | And on Saturday, Jesús Ochoa will talk about innovative horticulture, and Francisco Javier Pérez de la Cruz will discuss the energy and environmental cost. | 7    
La Escuela de Agrónomos de la UPCT cuenta con un stand en Fame Innowa y colabora con esta feria de tecnología agrícola. | The School of Agronomists of the UPCT has a booth at Fame Innowa and collaborates with this agricultural technology fair. | 9    
La rectora, Beatriz Miguel, visitó este miércoles el espacio ferial y agradeció la labor de difusión que realizan los estudiantes de la ETSIA. | The rector, Beatriz Miguel, visited the fairground this Wednesday and thanked the students of the ETSIA for their dissemination work. | 4
