sentence | translation | sdg
Prueba rápida de VIH de forma totalmente gratuita y confidencial con motivo de la celebración del Día Mundial del Sida. | Free and confidential rapid HIV test in celebration of World AIDS Day. | 3
Será el próximo jueves, 23 de noviembre, de 10:00 a 13:00 horas, en la Casa del Estudiante. | It will be next Thursday, November 23, from 10:00 to 13:00 hours, at the Student House. | 3
El método consiste en tomar una muestra de saliva y el resultado se obtiene en 30 minutos. | The method consists of taking a saliva sample and the result is obtained in 30 minutes. | 3
Esta acción la promueven el Servicio de Prevención de la UPCT y el Programa de Información y Educación sobre VIH/Sida y otras ITS de la Consejería de Salud debido a la importancia del diagnóstico precoz del VIH por las graves implicaciones en la salud individual y colectiva de la población. | This action is promoted by the Prevention Service of the UPCT and the Information and Education Program on HIV/AIDS and other STIs of the Ministry of Health due to the importance of early diagnosis of HIV because of the serious implications on the individual and collective health of the population. | 3
El Día Mundial del Sida se conmemora el próximo 1 de diciembre. | World AIDS Day is commemorated on December 1st. | 3
El mundo se une para apoyar a las personas que conviven con el VIH y para recordar a las que han fallecido por enfermedades relacionadas con el sida. | The world unites to support people living with HIV and to remember those who have died from AIDS-related illnesses. | 3
