sentence | translation | sdg
El Programa de becas de FMC LEAD 2023 ofrece dos becas con prácticas remuneradas de cinco meses en parcelas del campo de Cartagena y Almería Cartagena. | The FMC LEAD 2023 scholarship program offers two scholarships with paid internships for five months in fields in Cartagena and Almería Cartagena. | 4
También, brinda la oportunidad de pasar una semana en uno de los centros de investigación de FMC en Francia o Dinamarca con un mentor asignado. | It also provides the opportunity to spend a week at one of FMC's research centers in France or Denmark with an assigned mentor. | 4
Las actividades a realizar tienen lugar junto a la Cátedra FMC Agricultural Sciences de la Universidad Politécnica de Cartagena, que desarrolla actividades de investigación, formación y divulgación técnica en el área del desarrollo de cultivos mediterráneos. | The activities take place along with the FMC Agricultural Sciences Chair of the Polytechnic University of Cartagena, which carries out research, training, and technical dissemination activities in the area of Mediterranean crop development. | 4
Para aspirar a las dos becas del Programa LEAD de FMC, se contemplan los siguientes requisitos: Entre 20 y 30 años de edad, conocimientos básicos de agronomía y buena capacidad de comunicación verbal y escrita en inglés. | In order to apply for the two scholarships in the FMC LEAD Program, the following requirements are considered: Between 20 and 30 years old, basic knowledge of agronomy, and good verbal and written communication skills in English. | 4
La empresa FMC  ofrece poder convertirte en miembro del grupo de networking del sector de FMC,  que te conectará con otros candidatos y personas afines del sector. | The company FMC offers to become a member of the FMC sector networking group, connecting you with other candidates and like-minded individuals in the sector. | 9
Al participar en el Programa de Becas LEAD de FMC Corporation, empresa líder en tecnologías agrícolas, te permite combinar los estudios con la experiencia laboral; además,  de proporcionar una oportunidad única de establecer contactos, compartir ideas y desarrollar diferentes habilidades para liderar con confianza e impacto. | By participating in the FMC Corporation's LEAD Scholarship Program, a leading company in agricultural technologies, it allows you to combine studies with work experience; also providing a unique opportunity to establish contacts, share ideas, and develop different skills to lead with confidence and impact. | 9
La solicitud ha de enviarse en inglés en el siguiente enlace: https://fmcagro.es/trabaja-con-nosotros | The application must be submitted in English at the following link: https://fmcagro.es/trabaja-con-nosotros | 4
