sentence | translation | sdg
Durante estos últimos meses, la Autoridad Portuaria de Cartagena está realizando una serie de actuaciones dirigidas a mejorar la seguridad del tramo de la carretera de servicio que une las dársenas de Cartagena y Escombreras. | During these past months, the Port Authority of Cartagena has been carrying out a series of actions aimed at improving the safety of the service road section that connects the docks of Cartagena and Escombreras. | 9
A partir de mañana día 20 de marzo se cerrarán al tráfico debido a las labores de mantenimiento en el interior del túnel número 2, cuya finalización está prevista para el próximo 30 de abril. | Starting from tomorrow, March 20, they will be closed to traffic due to maintenance work inside tunnel number 2, which is expected to be completed by April 30th. | 9
El corte se realizará desde la boca de entrada al túnel 2 en Cala Cortina hasta los accesos al atraque de buques metaneros (Frente E-001), es decir, a la salida del túnel número 3. | The cut will be made from the entrance of tunnel 2 in Cala Cortina to the accesses to the mooring of methane vessels (Front E-001), that is, at the exit of tunnel number 3. | 9
También durante los días 3 y 4 de abril el corte al tráfico se ampliará desde el desvío del muelle de Curra hasta Cala Cortina para vehículos de todo tipo y peatones, debido a las actuaciones para llevar a cabo una nueva pavimentación del sendero peatonal en dicho vial. | Also, during the 3rd and 4th of April, the traffic cut will be extended from the deviation of Curra dock to Cala Cortina for all types of vehicles and pedestrians, due to the actions to carry out a new pavement of the pedestrian path in said road. | 9
Se ruega a todos los usuarios y posibles afectados de la realización de corte de tráfico en la carretera de servicio Cartagena-Escombreras máxima precaución en la circulación, así como su colaboración. | All users and potential affected by the traffic cut on the Cartagena-Escombreras service road are requested to exercise the utmost caution in circulation, as well as their collaboration. | 16
Las obras de pavimentación y protección de taludes en el vial de servicio Cartagena-Escombreras fueron adjudicadas por un millón trescientos cincuenta y cuatro mil euros, I.V.A. incluido, a Ferrovial Agroman, S.A. | The paving and slope protection works on the Cartagena-Escombreras service road were awarded for one million three hundred fifty-four thousand euros, including VAT, to Ferrovial Agroman, S.A. | 9
El objeto de este proyecto es seguir mejorando la situación de la carretera y están orientadas a la rehabilitación del pavimento, la mejora de la seguridad estructural de los túneles y la mejora de la estabilidad de los taludes. | The purpose of this project is to continue improving the road situation and is aimed at rehabilitating the pavement, improving the structural safety of the tunnels, and enhancing the stability of the slopes. | 9
Desde la APC realizamos infraestructuras sostenibles. | From the Port Authority of Cartagena, we carry out sustainable infrastructures. | 9
