sentence | translation | sdg
El presidente del Consejo de Estudiantes, Carlos Abrisqueta Vargas, ha tomado hoy posesión como vocal en el Consejo Social de la UPCT, durante el pleno ordinario celebrado en Rectorado. | The president of the Student Council, Carlos Abrisqueta Vargas, has today taken office as a vocal in the Social Council of the UPCT, during the ordinary session held at the Rectorate. | 4
El alumno ha sido designado por el Consejo de Gobierno de la Universidad. | The student has been appointed by the University's Government Council. | 4
Carlos Abrisqueta (Granada, 2001) ha terminado 4º cuarto del grado en Fundamentos de Arquitectura. | Carlos Abrisqueta (Granada, 2001) has completed the 4th year of the degree in Architectural Fundamentals. | 4
Preside el Consejo de Estudiantes desde el pasado mes de febrero. | He has been presiding the Student Council since last February. | 4
El nuevo vocal sustituye en el puesto a José María Pérez Valverde y su nombramiento tiene una duración duración de dos años. | The new vocal replaces José María Pérez Valverde in the position and his appointment has a duration of two years. | 4
