sentence | translation | sdg
Los estudiantes de cuarto del grado en Ingeniería Civil han visitado la EDAR (Estación Depuradora de Aguas Residuales) de Torre Pacheco. | Fourth-year Civil Engineering students visited the WWTP (Wastewater Treatment Plant) in Torre Pacheco.  | 6
Se trata del mayor tanque ambiental de la Región de Murcia. | This is the largest environmental tank in the Region of Murcia. | 6
Durante la visita, los estudiantes han podido conocer las diferentes fases que convierten el agua residual en agua regenerada. | During the visit, the students were able to learn about the different stages that convert wastewater into reclaimed water. | 6
La planta de Torre Pacheco está diseñada para tratar 7.500 m3 de agua al día y poder atender las necesidades de una población equivalente de hasta 81.000 habitantes, tres veces su población actual. | The Torre Pacheco plant is designed to treat 7,500 m3 of water per day and meet the needs of an equivalent population of up to 81,000 inhabitants, three times its current population. | 6
Para esta obra de ingeniería civil, inaugurada el pasado mes de marzo, se registraron 72.239 m3 de excavaciones, se emplearon 11.550 m3 de hormigón y 390.790 kg de acero corrugado, según los datos facilitados por la CARM. | For this civil engineering project, inaugurated last March, 72,239 m3 of excavations were recorded, 11,550 m3 of concrete were used, and 390,790 kg of corrugated steel were used, according to data provided by the CARM. | 6
Esta infraestructura pública, compuesta por una balsa de laminación y un tanque ambiental, tiene una capacidad total de 66.000 m3, el equivalente a 24 piscinas olímpicas. | This public infrastructure, composed of a sedimentation pond and an environmental tank, has a total capacity of 66,000 m3, equivalent to 24 Olympic swimming pools. | 6
