sentence | translation | sdg  
Concentración ciudadana en la puerta principal de la Escuela de Ingeniería Industrial para reclamar mejoras ferroviarias. | Citizen concentration at the main entrance of the School of Industrial Engineering to demand railway improvements. | 9   
Alrededor de una treintena de personas se han sumado a la convocatoria de la Asociación de Consumidores y Usuarios en Red (Consumur) en defensa de la modernización del transporte ferroviario entre Cartagena y Murcia. | Around thirty people have joined the call of the Network of Consumers and Users Association (Consumur) in defense of the modernization of the railway transport between Cartagena and Murcia. | 9  
El director de la Escuela Técnica Superior de Ingeniería Industrial, Patricio Franco, ha destacado la importancia de la creación de una línea de cercanías Murcia-Cartagena con trenes modernos, con frecuencias elevadas y tiempos más cortos, para facilitar el desplazamiento de trabajadores y estudiantes. | The director of the Higher Technical School of Industrial Engineering, Patricio Franco, has emphasized the importance of creating a commuter line Murcia-Cartagena "with modern trains, high frequencies, and shorter times, to facilitate the mobility of workers and students." | 9  
También se ha referido a la necesidad de apostar por medios de transporte más sostenibles, la inclusión de otras líneas de ferrocarril desde otras zonas de la Región y la intermodalidad entre los transportes públicos. | He has also referred to the need to bet on more sustainable means of transport, the inclusion of other railway lines from other areas of the Region, and intermodality between public transport. | 9  
El presidente de Consumur, Roberto Barceló, ha destacado la importancia de la defensa del ferrocarril y de las actuaciones que se necesitan para la mejora de estas infraestructuras. | The president of Consumur, Roberto Barceló, has highlighted the importance of defending the railway and the actions needed to improve these infrastructures. | 9  
Ha hecho referencia al tiempo que se lleva esperando la llegada del AVE a Cartagena y ha defendido la línea natural Cartagena-Chinchilla. | He has referred to the time that has been waiting for the arrival of the AVE to Cartagena and has defended the natural line Cartagena-Chinchilla. | 9  
