sentence | translation | sdg
La Escuela de Caminos y Minas ha celebrado este viernes 5 de mayo el acto de graduación de la X promoción del Máster en Ingeniería de Caminos, Canales y Puertos y de la XI promoción del Grado en Ingeniería Civil. | The School of Roads and Mines celebrated on Friday, May 5th, the graduation ceremony of the X class of the Master's Degree in Civil Engineering, Channels, and Ports, and the XI class of the Degree in Civil Engineering. | 4
Durante el acto se entregaron los premios al mejor Trabajo Fin de Grado y Trabajo Fin de Máster. | During the event, awards were given for the best Bachelor's and Master's Theses. | 4
La Rectora, Beatriz Miguel, expresó su agradecimiento a la empresa Regenera por su colaboración y compromiso con la Escuela de Caminos y Minas en materia de I+D+i. | The Rector, Beatriz Miguel, expressed her gratitude to the company Regenera for their collaboration and commitment to the School of Roads and Mines in the field of R&D. | 9
Beatriz Miguel también agradeció a la empresa Getnisa su labor en la mejora de la empleabilidad de los egresados de la Escuela de Caminos y Minas. | Beatriz Miguel also thanked the company Getnisa for their work in improving the employability of graduates from the School of Roads and Mines. | 8
También recibió premio el profesor Juan José Jorquera por su labor en la labor de difusión y captación en este centro de la UPCT. | Professor Juan José Jorquera also received an award for his work in dissemination and recruitment at this center of the UPCT. | 4
