sentence | translation | sdg
Llegan las primeras fiestas universitarias del nuevo curso académico. | The first university parties of the new academic year are here. | 
Del 29 de septiembre al 6 de octubre de 2023 se desarrollaron actividades deportivas y lúdicas con motivo de las Fiestas de Acogida: torneos de billar, futbolín, dardos, lanzamiento de hueso de oliva, comeflanes… así como de videojuegos como el FIFA 23. | From September 29 to October 6, 2023, sports and recreational activities were carried out on the occasion of the Welcome Parties: billiards tournaments, table football, darts, olive stone throwing, eating competitions… as well as video games like FIFA 23. | 
La inscripción en los torneos se puede hacer aquí. | Registration for the tournaments can be done here. | 
Las Prepaellas y Paellas de Acogida son el evento principal y se celebrarán la noche del jueves 5 y la tarde del viernes 6. | The Prepaellas and Welcome Paellas are the main event and will be held on the night of Thursday the 5th and the afternoon of Friday the 6th. | 
Se realizan en el recinto situado en el Campus Muralla del Mar, junto al edificio de la Escuela Técnica Superior de Ingeniería Industrial (ETSII), que cuenta con 8.400 metros cuadrados y estará equipado con lo necesario para poder pasar un agradable rato de fiesta: barras, aseos portátiles, seguridad privada, asistencia medicalizada, puestos de comida, así como control de accesos. | They take place in the area located in the Muralla del Mar Campus, next to the building of the Higher Technical School of Industrial Engineering (ETSII), which has 8,400 square meters and will be equipped with everything necessary to have a pleasant party time: bars, portable toilets, private security, medical assistance, food stands, as well as access control. | 
La venta de entradas está ya abierta. | Ticket sales are already open. | 
Las fiestas oficiales de la UPCT son organizadas por la Asociación de Fiestas de la Universidad Politécnica de Cartagena, compuesta por estudiantes de la UPCT. | The official parties of the UPCT are organized by the Association of Parties of the Polytechnic University of Cartagena, composed of UPCT students. | 
