sentence | translation | sdg  
Ya está abierto el plazo para la Carrera UPCT 25º Aniversario | The registration period for the UPCT 25th Anniversary Race is now open | 3  
que se celebrará el próximo 1 de octubre | that will take place on October 1st | 3  
Los participantes recorrerán 6,5 kilómetros sobre un circuito urbano | Participants will cover 6.5 kilometers on an urban circuit | 3  
que tendrá como lugar de salida y meta el parking del campus Muralla del Mar | which will have the parking of the Muralla del Mar campus as the start and finish point | 3  
El inicio está previsto a las 9:30 horas para las citas infantiles | The start is scheduled for 9:30 am for the children's races | 3  
La prueba absoluta comentará a las 10:30 horas | The main race will start at 10:30 am | 3  
Las inscripciones se pueden realizar a través de Alcanza Tu Meta hasta el 28 de septiembre, a las 21:00 horas | Registrations can be made through Alcanza Tu Meta until September 28th, at 9:00 pm | 3  
a través de pago con tarjeta (TPV) o alcanzar el límite de inscritos | through payment by credit card (TPV) or reaching the participant limit | 3  
La carrera la organiza la UPCT en colaboración con la Concejalía de Deportes del Ayuntamiento de Cartagena, la Autoridad Portuaria y la Federación de Atletismo de la Región de Murcia (FAMU) | The race is organized by UPCT in collaboration with the Department of Sports of the Cartagena City Council, the Port Authority, and the Athletics Federation of the Region of Murcia (FAMU) | 3  
