sentence|translation|sdg
Varios estudiantes y profesores del curso en Tecnologías Postcosecha de la UPCT han cruzado el Atlántico expresamente para participar en la decimoctava edición de esta semana de formación especializada que concluye hoy.|Several students and professors from the Postharvest Technologies course at UPCT have crossed the Atlantic expressly to participate in the eighteenth edition of this specialized training week that concludes today.|4
"En postcosecha, con la globalización, todo está interconectado y es normal que empresas e instituciones del continente americano quieran que su personal aprenda las últimas técnicas y metodologías desarrolladas", explica uno de los docentes llegados desde el extranjero, el catedrático de la Texas Agriculture & Life Science University Luis Cisneros Zeballos.|In postharvest, with globalization, everything is interconnected and it is normal for companies and institutions in the American continent to want their staff to learn the latest developed techniques and methodologies," explains one of the teachers who came from abroad, the professor from Texas Agriculture & Life Science University, Luis Cisneros Zeballos.|4
Cisneros ha participado desde 2007 en diversas ediciones del curso en Tecnologías Postcosecha que organiza el Grupo en Postrecolección y Refrigeración de la UPCT.|Cisneros has been participating since 2007 in various editions of the Postharvest Technologies course organized by the Postharvest and Refrigeration Group at UPCT.|4
"Coincidí con él a comienzos de los noventa en la Universidad de California", explica el fundador del grupo, Francisco Artés Calero.|"I coincided with him in the early nineties at the University of California," explains the founder of the group, Francisco Artés Calero.|4
"De allí cogí la idea de organizar un curso con los mejores expertos en postcosecha hispanohablantes del mundo", añade.|"From there, I got the idea to organize a course with the best Spanish-speaking postharvest experts in the world," he adds.|4
"Participo en el curso cada vez que puedo porque siempre es de mucha ayuda intercambiar ideas con los colegas, ver lo que se está haciendo en esta parte del mundo y recibir 'feedback' sobre tus propias investigaciones", comenta el docente de origen peruano, que destaca la gran conexión con el sector agrícola de la Escuela de Agrónomos de la UPCT.|"I participate in the course whenever I can because it is always very helpful to exchange ideas with colleagues, see what is being done in this part of the world, and receive 'feedback' on your own research," comments the teacher of Peruvian origin, who highlights the strong connection with the agricultural sector of the Agronomists School of UPCT.|4
