sentence | translation | sdg
La rectora de la UPCT, Beatriz Miguel, ha recibido este jueves el premio 'Importantes' que organiza el diario La Opinión. | The rector of UPCT, Beatriz Miguel, received on Thursday the 'Important' award organized by La Opinión newspaper. | 4
El galardón reconoce la trayectoria de excelencia en Docencia e Innovación del Campus de Cartagena, a lo largo de sus 25 años de existencia. | The award recognizes the track record of excellence in teaching and innovation at the Cartagena Campus, throughout its 25 years of existence. | 4
Beatriz Miguel ha agradecido el reconocimiento, en nombre de la comunidad docente a la que representa, y ha recordado que el centro ha sido uno de los motores de crecimiento económico, ya que sus estudios e investigaciones han contribuido al despegue de la Región de Murcia y Cartagena en campos industriales tan importantes como el tecnológico, el naval o el agroalimentario. | Beatriz Miguel thanked for the recognition on behalf of the teaching community she represents, and remembered that the center has been one of the engines of economic growth, as its studies and research have contributed to the development of the Region of Murcia and Cartagena in industrial fields as important as technology, naval, or agri-food. | 4, 9
La rectora ha querido dedicar el premio a los miles de egresados del campus de Cartagena, quienes son un referente esencial para el perfeccionamiento de la calidad académica de la institución. | The rector wanted to dedicate the award to the thousands of graduates from the Cartagena campus, who are an essential reference for the improvement of the academic quality of the institution. | 4
Según declaró, para la Universidad es motivo de orgullo el desempeño y avances en la carrera profesional de nuestros egresados, lo que reafirma la contribución de la UPCT en la formación de personas con visión humanística, creativa e innovadora. | As stated, "for the University, it is a source of pride the performance and advancements in the professional career of our graduates, which reaffirms the contribution of UPCT in the education of people with a humanistic, creative, and innovative vision." | 4, 8
A las doce personalidades premiadas, que han sido elegidas cada mes por los miembros de la Redacción, se ha añadido en esta edición un premio honorifico para el submarino S-81 'Isaac Peral', construido en Navantia. | In addition to the twelve personalities awarded, who have been chosen every month by the Editorial team, an honorary prize has been added in this edition for the S-81 'Isaac Peral' submarine, built at Navantia. | 4, 9
