sentence | translation | sdg
Investigadores de la Escuela de Ingeniería Agronómica de la UPCT están midiendo las emisiones de gases en manzano y peral en fincas ubicadas en las localidad alicantina de Cañada | Researchers from the School of Agronomic Engineering of UPCT are measuring gas emissions in apple and pear trees in farms located in the town of Cañada, Alicante. | 9
De albaricoques en Pinoso, también Comunidad Valenciana. | Of apricots in Pinoso, also in Valencian Community. | 9
Estos trabajos se enmarcan en el proyecto de investigación Sostenibilidad de cultivos leñosos mediante el uso de cubiertas vegetales: secuestro de carbono, misiones de gases de efecto invernadero funcionalidad de suelos (CLIMCOVER). | These works are part of the research project 'Sustainability of woody crops through the use of vegetative covers: carbon sequestration, greenhouse gas emissions, soil functionality' (CLIMCOVER). | 9
Los investigadores estudiarán durante cuatro años el impacto en las explotaciones en comparación con aquellas en las que no hay cubiertas vegetales. | The researchers will study the impact on the farms for four years compared to those without vegetative covers. | 9
Las fincas de ensayo están en la Región de Murcia, Andalucía, Comunidad Valenciana y Castilla-La Mancha y en ellas se cultivan olivos, almendros, manzanos, perales y albaricoqueros. | The trial farms are located in the Region of Murcia, Andalusia, Valencian Community, and Castilla-La Mancha, where olive trees, almond trees, apple trees, pear trees, and apricot trees are grown. | 2
El proyecto (TED2021-129527B-I00) está financiado por una convocatoria estatal y con fondos Next Generation. | The project (TED2021-129527B-I00) is funded by a state call and Next Generation funds. | 9
