sentence | translation | sdg
El profesor del Departamento de Matemática Aplicada y Estadística de la UPCT, Juan Carlos Trillo, imparte este viernes una conferencia sobre divulgación científica titulada Matemáticas recreativas y creativas en La Universidad de La Rioja. | Professor Juan Carlos Trillo from the Department of Applied Mathematics and Statistics at UPCT will give a conference on scientific outreach titled 'Recreational and Creative Mathematics' at the University of La Rioja. | 4
Trillo presentará ideas básicas y muy potentes de cómo crear conceptos, ideas, juegos y materiales nuevos y tratará temáticas relacionadas con las matemáticas y que contienen aspectos lúdicos, tales como el ajedrez, el cubo de Rubik o trucos de cartas, entre otras cosas. | Trillo will present basic and very powerful ideas on how to create new concepts, ideas, games, and materials, and will address topics related to mathematics that include playful aspects, such as chess, the Rubik's cube, or card tricks, among other things. | 4
La charla tendrá lugar a las 19:00 horas en el complejo Científico-Tecnológico de la Universidad de La Rioja y forma parte de las actividades organizadas por el XLIV Curso de actualización en matemáticas. | The talk will take place at 19:00 at the Scientific-Technological Complex of the University of La Rioja and is part of the activities organized by the XLIV Mathematics Update Course. | 4
La charla también se podrá seguir online a través del siguiente enlace: https://eu.bbcollab.com/collab/ui/session/guest/c153c0024ee44ecea36e74bc80c3ec22. | The talk can also be followed online through the following link: https://eu.bbcollab.com/collab/ui/session/guest/c153c0024ee44ecea36e74bc80c3ec22. | 4
Trillo colabora habitualmente en las actividades de divulgación científica que organiza la UCC+i de la UPCT, tratando de hacer un acercamiento ameno a las matemáticas para que no se perciba como una materia fea e innaccesible. | Trillo regularly collaborates in scientific outreach activities organized by the UCC+i of UPCT, aiming to make a friendly approach to mathematics so that it is not perceived as a "boring and inaccessible" subject. | 4
Así lo indica en la descripción del último taller que ha desarrollado, junto con los también profesores de la UPCT Carlos Angosto y Juan Ruiz Álvarez, dirigido principalmente a alumnado de Primaria y Secundaria y titulado Jugando con las matemáticas y la ingeniería. | This is indicated in the description of the last workshop he has conducted, along with fellow UPCT professors Carlos Angosto and Juan Ruiz Álvarez, mainly aimed at Primary and Secondary students and titled 'Playing with Mathematics and Engineering.' | 4
Con esta actividad ha llevado la divulgación científica a las calles de Cartagena y Murcia, pues en este curso ya ha participado en la Noche Europea de los Investigadores, la Semana de la Ciencia y la Tecnología en Murcia, así como en el programa educativo Ingeniosanos, que se lleva a cabo en las aulas hospitalarias de La Arrixaca, en Murcia, y del Santa Lucía, en Cartagena. | With this activity, he has taken scientific outreach to the streets of Cartagena and Murcia, as he has already participated in the European Researchers' Night, the Science and Technology Week in Murcia, as well as in the educational program called Ingeniosanos, which is carried out in the hospital classrooms of La Arrixaca in Murcia and Santa Lucía in Cartagena. | 4
