sentence | translation | sdg
Autoridad Portuaria de Cartagena (APC), Universidad Politécnica de Cartagena y Universidad de Murcia han renovado hoy la Cátedra Interuniversitaria de Medio Ambiente Mare Nostrum (Cátedra de Medio Ambiente APC - CMN). | Port Authority of Cartagena (APC), Polytechnic University of Cartagena and University of Murcia have renewed today the Interuniversity Chair of the Mare Nostrum Environment (APC - CMN Environmental Chair). | 4
Nacida en 2015, se ha convertido en una alianza entre la APC y las universidades públicas de la Región para avanzar hacia un puerto más sostenible a través de la investigación de I+D+I, de asistencia tecnológica y científica, así como de acciones formativas y divulgativas en el ámbito medioambiental. | Born in 2015, it has become an alliance between the APC and the public universities of the Region to advance towards a more sustainable port through R&D, technological and scientific assistance, as well as training and dissemination actions in the environmental field. | 4
La Cátedra, dirigida por la profesora María José Vicente, centrará en temas relacionados con la biodiversidad y con la gestión responsable de las especies y de los hábitats, principalmente, del entorno portuario, | The Chair, led by Professor María José Vicente, will focus on issues related to biodiversity and responsible management of species and habitats, mainly in the port environment, | 15
el fomento de conceptos y herramientas ambientales, tales como los Bancos de Conservación de la Naturaleza, la custodia ambiental del territorio, la gestión de los recursos naturales, la integración de la evaluación ambiental en la planificación y gestión de las empresas, así como el diseño de medidas dirigidas a la conservación, uso sostenible, mejora, restauración y compensación del patrimonio natural y de la biodiversidad. | the promotion of environmental concepts and tools, such as Natural Conservation Banks, environmental land stewardship, management of natural resources, integration of environmental assessment in business planning and management, as well as the design of measures aimed at conservation, sustainable use, improvement, restoration, and compensation of natural heritage and biodiversity. | 15
La UPCT y la Universidad de Murcia se encargarán, principalmente, del desarrollo de estudios e investigaciones en materia medioambiental, de la realización de acciones formativas y académicas que permitan mejorar la calidad y  la consolidación del conocimiento en este ámbito y de la organización de actividades orientadas a la sensibilización, difusión y reflexión sobre aquellas cuestiones relacionadas con el contenido de la Cátedra. | The UPCT and the University of Murcia will be mainly responsible for the development of studies and research in environmental matters, the implementation of training and academic actions that improve the quality and consolidation of knowledge in this area, and the organization of activities aimed at raising awareness, dissemination, and reflection on issues related to the content of the Chair. | 4
La Autoridad Portuaria de Cartagena colaborará con las dos universidades en la realización de actividades de asesoramiento, investigación y formación; pondrá a su disposición las  instalaciones propias que puedan ser necesarias para el desarrollo de la Cátedra, promoverá actividades de divulgación, difusión, comunicación y promoción de las actuaciones llevadas a cabo; y colaborará en la búsqueda de fondos europeos y de investigación destinados a la realización de actividades relacionadas con la protección, conservación y mejora del medio ambiente. | The Port Authority of Cartagena will collaborate with the two universities in carrying out advisory, research, and training activities; will provide its own facilities that may be necessary for the development of the Chair, promote dissemination, communication, and promotion activities of the actions carried out, and collaborate in the search for European funds and research aimed at carrying out activities related to the protection, conservation, and improvement of the environment. | 4, 17
El acto de firma del Convenio ha tenido lugar hoy en Autoridad Portuaria. | The signing ceremony of the Agreement took place today at the Port Authority. | 16
Han asistido la rectora de la UPCT, Beatriz Miguel; el presidente en funciones de la APC, Pedro Pablo Hernández, y el rector de la UMU, José Luján. | Attending were the rector of UPCT, Beatriz Miguel; the acting president of APC, Pedro Pablo Hernández, and the rector of UMU, José Luján. | 4
