sentence|translation|sdg
Hacer una inmersión de hasta 40 metros y disfrutar de increíbles vistas bajo el mar proporciona experiencias únicas e inolvidables|Diving up to 40 meters and enjoying incredible views under the sea provides unique and unforgettable experiences|14
Y al convertirte en patrón de embarcaciones y navegar en barco descubrirás lugares únicos para echar el ancla, darse un baño o fondear y explorar|And by becoming a boat skipper and sailing, you will discover unique places to drop anchor, swim, or explore|14
Son dos de las posibilidades que ofrecen los Cursos de Verano de la UPCT para el mes de junio|These are two of the possibilities offered by the UPCT Summer Courses for the month of June|4
El vicerrectorado de Estudiantes, consciente de que el buceo y la navegación en barco son las mejores opciones deportivas para disfrutar del mar y los fondos marinos, en los que hay mucho por descubrir, promueve un programa completo de formación en submarinismo y embarcación|The Student Vice Chancellor's Office, aware that diving and boat navigation are the best sports options to enjoy the sea and the seabed, where there is much to discover, promotes a complete training program in diving and boating|14
Las personas podrán aprender y convertirse en profesionales del buceo y patrones de barco, obteniendo licencias y certificados|People will be able to learn and become professionals in diving and boat skippers, obtaining licenses and certificates|4
A cargo de una de las mejores escuelas de España, la Escuela Militar de Buceo en Cartagena, y en manos de los mejores expertos|Led by one of the best schools in Spain, the Military Diving School in Cartagena, and in the hands of the best experts|4
Dentro de la oferta de los Cursos de Verano 2023 de la UPCT, dirigidos al público en general, se encuentran dos cursos, el de buceo avanzado y el de técnicas de navegación marítima, de tres semanas de duración cada uno, que se desarrollan entre el 19 de junio al 7 de julio, en la Escuela Militar de Buceo, ubicada dentro de la Estación Naval de la Algameca (ENA) en Cartagena|Within the offering of the UPCT Summer Courses 2023, aimed at the general public, there are two courses, the advanced diving course and the maritime navigation techniques course, each lasting three weeks, and taking place between June 19th and July 7th, at the Military Diving School located within the Algameca Naval Station (ENA) in Cartagena|4,14
