sentence | translation | sdg
El presidente y el director general de la Autoridad Portuaria de Cartagena asisten al XXVI Congreso Latinoamericano de Puertos, que se desarrolla en esta ocasión en Punta del Este (Uruguay) desde el 6 al 9 de noviembre. | The president and the general director of the Port Authority of Cartagena attend the XXVI Latin American Ports Congress, which is taking place this time in Punta del Este (Uruguay) from November 6 to 9. | 9
El programa oficial contará con la apertura del Ministro de Transporte del país sudamericano, Víctor Rossi, quien detallará la proyección logística del Uruguay y dará paso a un panel de expertos para analizar el comercio y el transporte ante un nuevo orden mundial. | The official program will start with the opening by the Minister of Transport of the South American country, Víctor Rossi, who will detail Uruguay's logistical projection and give way to a panel of experts to analyze trade and transport in the face of a new world order. | 9
Antonio Sevilla participa en el panel Las perspectivas de las terminales graneleras junto con Pablo Pussetto (Argentina) y Nicholas Ingle (Inglaterra). | Antonio Sevilla participates in the panel 'The perspectives of bulk terminals' along with Pablo Pussetto (Argentina) and Nicholas Ingle (England). | 9
Paralelamente expondrán proyectos especiales sobre gráneles: Tessa Major (Amberes), Ramón RullMagre (Barcelona) y Rodolfo Sabonge. | In parallel, they will present special projects on grains: Tessa Major (Antwerp), Ramón RullMagre (Barcelona) and Rodolfo Sabonge. | 9
Entre los expertos participantes en el congreso se encuentran Carlos Urriola, vicepresidente ejecutivo de Manzanillo Internacional Terminal Panamá; Giovanni Benedetti, gerente comercial de Sociedad Portuaria Regional de Cartagena, Colombia; Yurik Díaz, gerente de la División de Terminales Portuarias en SAAM, Chile; Paul Gallie, jefe para las Américas de Portek y jefe de Desarrollo de Proyectos Portuarios e Infraestructura para las Américas de Mitsui, México; Antonio Domínguez, director de Maersk; Juan Carlos Muñoz Menna, presidente del Centro de Armadores Fluviales y Marítimos del Paraguay; Oscar Bazán, vicepresidente ejecutivo de Planeación y Desarrollo de Negocios del Canal de Panamá y Gonzalo Mórtola, interventor de la AGP, Puerto de Buenos Aires. | Among the experts participating in the congress are Carlos Urriola, executive vice president of Manzanillo Internacional Terminal Panamá; Giovanni Benedetti, commercial manager of Sociedad Portuaria Regional de Cartagena, Colombia; Yurik Díaz, manager of the Port Terminals Division at SAAM, Chile; Paul Gallie, head for the Americas of Portek and head of Port Projects and Infrastructure Development for the Americas of Mitsui, Mexico; Antonio Domínguez, director of Maersk; Juan Carlos Muñoz Menna, president of the Center of River and Maritime Shipowners of Paraguay; Oscar Bazán, executive vice president of Planning and Business Development of the Panama Canal and Gonzalo Mórtola, intervenor of the AGP, Port of Buenos Aires. | 9
Los temas que prevén abordar los conferencistas son las perspectivas en la industria marítima portuaria de la región, el análisis de cómo afecta a la actividad la revolución digital, el desarrollo de las hidrovías y la optimización y sustentabilidad en las operaciones, entre otros. | The topics that the speakers plan to address are the perspectives in the maritime port industry of the region, the analysis of how the digital revolution affects the activity, the development of waterways, and optimization and sustainability in operations, among others. | 9
Asimismo, expertos como Rafael Farromeque (CAF), Adalberto Tokarski (Brasil), Walker San Miguel Rodríguez (CAN), Juan Carlos Venesia (Argentina) y Bernardo Gastón Silbermann (Uruguay), analizarán cómo optimizar la función logística de las hidrovías. | Likewise, experts such as Rafael Farromeque (CAF), Adalberto Tokarski (Brazil), Walker San Miguel Rodríguez (CAN), Juan Carlos Venesia (Argentina), and Bernardo Gastón Silbermann (Uruguay) will analyze how to optimize the logistics function of the waterways. | 9
Finalmente, el cierre del congreso estará a cargo de distintas autoridades portuarias de la región como Fernando Gamboa Rosas (México); Ángel Elías (Argentina); Arturo Rojas (Argentina); Víctor Julio González Riascos (Colombia) y Francisco Javier González (Chile), siempre moderados por expertos del sector portuario internacional. | Finally, the closing of the congress will be in charge of different port authorities of the region such as Fernando Gamboa Rosas (Mexico); Ángel Elías (Argentina); Arturo Rojas (Argentina); Víctor Julio González Riascos (Colombia) and Francisco Javier González (Chile), always moderated by international port sector experts. | 9
La amplia experiencia de los conferencistas que se darán cita en Sudamérica evidencia una nueva instancia de consolidación e impulso para el sector portuario latinoamericano y en su relación con otras regiones. | The extensive experience of the conference attendees who will meet in South America demonstrates a new instance of consolidation and impetus for the Latin American port sector and its relationship with other regions. | 9
