sentence | translation | sdg
Las universidades politécnicas de Cartagena (UPCT), Valencia (UPV), Cataluña (UPB) y Madrid (UPM), que conforman la alianza UP4, se han reunido hoy para analizar, entre otros temas de interés común, el impacto de la Ley Orgánica del Sistema Universitario (LOSU) en las políticas universitarias sectoriales | The polytechnic universities of Cartagena (UPCT), Valencia (UPV), Catalonia (UPB) and Madrid (UPM), which make up the UP4 alliance, have met today to analyze, among other topics of common interest, the impact of the Organic Law of the University System (LOSU) on sectorial university policies | 4
la situación del nuevo estatuto de las personas en formación práctica en el ámbito de la empresa | the situation of the new statute of people in practical training in the field of business | 4
el proyecto de Centro de Investigación e Innovación en Movilidad Avanzada (CIIMA-UP4) y FuturPyme | the project of Research and Innovation Center on Advanced Mobility (CIIMA-UP4) and FuturPyme | 9
El objetivo de UP4 es promover la colaboración entre las cuatro universidades politécnicas españolas, tanto desde una perspectiva institucional como entre sus centros docentes, estructuras de investigación, profesorado y gestores | The objective of UP4 is to promote collaboration among the four Spanish polytechnic universities, both from an institutional perspective and among their teaching centers, research structures, faculty, and managers | 4
Su actividad se extiende a todos los ámbitos universitarios: la docencia, la investigación, la transferencia de conocimiento y la innovación | Its activity extends to all university fields: teaching, research, knowledge transfer, and innovation | 4
