sentence | translation | sdg
El equipo Domo, del IES José Ibañez Martín, de Lorca ha ganado la medalla de oro de la VI Olimpiada de Arquitectura de la Región de Murcia, integrado por ocho alumnas: Carmen Mateo, Marta Merlos, Lucía Ríos, Irina Stancu, María García, Antonio Parra, Lucía García y Miriam García; junto a sus dos tutores, Germán Ramos y Mar Piñera. | Team 'Domo' from IES José Ibañez Martín in Lorca won the gold medal at the VI Architecture Olympiad of the Region of Murcia, consisting of eight students: Carmen Mateo, Marta Merlos, Lucía Ríos, Irina Stancu, María García, Antonio Parra, Lucía García, and Miriam García; along with their two mentors, Germán Ramos and Mar Piñera. | 4
En segundo lugar, ha quedado el equipo Los Insanos, del IES, Príncipe de Asturias de Lorca, con medalla de plata; y en tercer lugar, el equipo Archipoetas, del IES Poeta Sánchez Bautista de Murcia, con medalla de bronce. | In second place, the team 'Los Insanos' from IES Príncipe de Asturias in Lorca, won the silver medal; and in third place, the team 'Archipoetas' from IES Poeta Sánchez Bautista in Murcia, won the bronze medal. | 4
El proyecto ganador ha obtenido 400 euros para poder invertir en su proyecto que consiste en el aprovechamiento del espacio del salón de actos de su Instituto, que antes era una iglesia con cruz latina, para otros ambientes distribuidos en cinco módulos: de Artes Plásticas, Artes Escénicas, Audiovisuales, espacio expositivo y módulo de recepción o hall. | The winning project received 400 euros to invest in converting the space of the auditorium of their Institute, which was previously a church with a Latin cross, into other environments distributed in five modules: Plastic Arts, Performing Arts, Audiovisuals, exhibition space, and reception or hall module. | 9
Además de un sistema sonoro e iluminación y el uso de tatami, un material orgánico similar al cáñamo o lino para el espacio escénico multiuso. | Additionally, a sound system and lighting, and the use of tatami, an organic material similar to hemp or linen, for the multi-purpose scenic space. | 7
Un año más la Escuela Técnica Superior de Arquitectura y Edificación de la Universidad Politécnica de Cartagena ha organizado las Olimpiadas de Arquitectura de la Región de Murcia; un concurso que lleva seis ediciones y que en esta ocasión ha contado con la participación de 190 alumnos de Educación Secundaria, repartidos en 35 equipos procedentes de 23 centros educativos y 10 municipios de la Región de Murcia, y uno de la provincia de Alicante. | Once again, the Superior Technical School of Architecture and Building of the Polytechnic University of Cartagena organized the Architecture Olympiad of the Region of Murcia; a competition that has had six editions and this time had the participation of 190 secondary education students, divided into 35 teams from 23 educational centers and 10 municipalities in the Region of Murcia, and one from the province of Alicante. | 4
Han inaugurado el evento la directora general de Universidades e Investigación de la CARM, Isabel Fortea, en representación del gobierno regional; Sergio Amat, vicerrector de Estudios, Cultura y Deporte de la UPCT; Antonio González Valverde, director gerente de la Fundación Séneca; y Carlos Parra, director de la ETS de Arquitectura y Edificación. | The opening of the event was attended by the Director General of Universities and Research of the CARM, Isabel Fortea, on behalf of the regional government; Sergio Amat, Vice-Rector for Studies, Culture, and Sports at UPCT; Antonio González Valverde, Managing Director of the Séneca Foundation; and Carlos Parra, Director of the ETS of Architecture and Building. | 4
El objetivo principal de este concurso es ofrecer proyectos para la transformación de los espacios de sus propios centros educativos, invitar a reflexionar sobre su aprovechamiento, innovación y sacar la parte creativa de los estudiantes, guiados por su profesor. | The main objective of this competition is to offer projects for the transformation of the spaces in their own educational centers, to encourage reflection on their use, innovation, and bring out the creativity of the students, guided by their teacher. | 4
Esta Olimpiada (22159/OLIM/22) es el resultado de una ayuda a la organización de olimpiadas científicas de la Región de Murcia financiada por la Consejería de Empresa, Empleo, Universidades y Portavocía, a través de la Fundación Séneca-Agencia de Ciencia y Tecnología de la Región de Murcia. | This Olympiad (22159/OLIM/22) is the result of support for the organization of scientific olympiads in the Region of Murcia funded by the Ministry of Business, Employment, Universities, and Spokesmanship, through the Séneca Foundation-Agency of Science and Technology of the Region of Murcia. | 4
