sentence | translation | sdg
La Autoridad Portuaria de Cartagena celebra hoy y mañana en la Universidad Politécnica de Cartagena las jornadas sobre Las TIC como impulsoras de la competitividad y la eficiencia en las Autoridades Portuarias, enfocadas a la importancia de la introducción de las nuevas tecnologías en el entorno portuario. | The Port Authority of Cartagena celebrates today and tomorrow at the Polytechnic University of Cartagena the conference on "ICT as drivers of competitiveness and efficiency in Port Authorities", focused on the importance of introducing new technologies in the port environment. | 9
El evento ha sido inaugurado por Antonio Sevilla, Presidente del Puerto de Cartagena, que ha hecho hincapié en la importancia de las TIC: hoy en día, la tecnología y el universo digital están más presentes que nunca en la sociedad. | The event was inaugurated by Antonio Sevilla, President of the Port of Cartagena, who emphasized the importance of ICT: "nowadays, technology and the digital world are more present than ever in society." | 9
Por otra parte, ha querido incidir en el importante cambio que supone su introducción en la gestión laboral, los nuevos entornos digitales transforman por completo la forma de comunicarnos tanto en la empresa como con los sectores empresariales. | On the other hand, he wanted to emphasize the significant change that its introduction implies in labor management, "the new digital environments completely transform the way we communicate both within the company and with the business sectors." | 8
Asimismo, Antonio Sevilla ha querido agradecer a las empresas patrocinadoras, IBM, Dacartec, Fortines, Arrow y VMARE, su contribución para la organización del evento. | Likewise, Antonio Sevilla wanted to thank the sponsoring companies, IBM, Dacartec, Fortines, Arrow, and VMARE, for their contribution to the organization of the event. | 17
Durante el 22 y 23 de junio, los ponentes invitados se proponen abarcar cuestiones relacionadas con el entorno portuario y sus herramientas de comunicación interna mediante redes digitales colaborativas. | During June 22 and 23, the invited speakers aim to cover issues related to the port environment and its internal communication tools through collaborative digital networks. | 9
Las jornadas profundizan, también, en la ciberseguridad y su evolución para hacer frente al colectivo de ciberdelincuentes dentro del sector empresarial. | The conference also delves into cybersecurity and its evolution to address the group of cybercriminals within the business sector. | 9
Asimismo, el objetivo es tratar, además, soluciones de inteligencia de negocio, seguridad física en instalaciones TIC y enfoques para la virtualización de datos. | Likewise, the aim is to address business intelligence solutions, physical security in ICT facilities, and approaches to data virtualization. | 9
A las jornadas asisten representantes de Autoridades Portuarias de diferentes puntos de España: Alicante, Avilés, Baleares, Bilbao, Cádiz, Cartagena, Castellón, Huelva, Las Palmas, Málaga, Melilla, Santander, Tenerife, Valencia, Vilagarcía de Arousa y Puertos del Estado. | Representatives of Port Authorities from different parts of Spain are attending the conference: Alicante, Avilés, Balearic Islands, Bilbao, Cadiz, Cartagena, Castellón, Huelva, Las Palmas, Malaga, Melilla, Santander, Tenerife, Valencia, Vilagarcía de Arousa, and Ports of the State. | 9
El Puerto de Cartagena ha realizado en los últimos años diversas actuaciones e implantaciones tecnológicas, como la Nueva Intranet Social (red interna colaborativa para los empleados de la comunidad portuaria) y Levante Sin Papeles (herramienta de agilización de trámites burocráticos en el entorno digital), que la han posicionado como pionera en la implantación de las TIC dentro de su sector y han sido merecedoras de varios premios. | The Port of Cartagena has carried out various technological actions and implementations in recent years, such as the New Social Intranet (collaborative internal network for port community employees) and Levante Sin Papeles (tool to streamline bureaucratic procedures in the digital environment), positioning it as a pioneer in the implementation of ICT within its sector and earning several awards. | 9
