sentence | translation | sdg 
La UPCT ha titulado a más de 300 arquitectos y arquitectas, en proporción casi idéntica, desde que hace 15 años se implantaran en Cartagena los estudios que habilitan para ejercer esta profesión que combina los conocimientos técnicos, artísticos y humanísticos. | UPCT has awarded more than 300 architects, in almost identical proportions, since the studies enabling the practice of this profession that combines technical, artistic, and humanistic knowledge were implemented in Cartagena 15 years ago. | 4 
La Politécnica conmemora este año la efeméride con una muestra de los mejores proyectos finales de carrera realizados en el grado en Arquitectura. | The Polytechnic commemorates this year with an exhibition of the best final projects carried out in the Architecture degree. | 4 
La ETSAE (Escuela Técnica Superior de Arquitectura y Edificación) muestra durante el mes de junio una exposición con motivo del aniversario de la implantación de los estudios de Arquitectura en la UPCT en la que muestra los proyectos de sus mejores estudiantes. | The ETSAE (Higher Technical School of Architecture and Building) shows an exhibition during the month of June on the anniversary of the implementation of Architecture studies in the UPCT, showcasing the projects of its best students. | 4 
La exposición '2008-2023: 15 años de Arquitectura en la UPCT' ha seleccionado una treintena de Trabajos Fin de Estudios (TFE) del grado en Arquitectura que obtuvieron sobresaliente o matrícula de honor, y recoge también la trayectoria profesional de sus autores tras formarse en la Politécnica y los temas y lugares que han abordado los proyectos académicos de la ETSAE durante estos tres lustros. | The exhibition '2008-2023: 15 years of Architecture at UPCT' has selected thirty Final Degree Projects (TFE) from the Architecture degree that received outstanding or honors marks, and also covers the professional trajectory of its authors after training at the Polytechnic and the themes and places addressed by the academic projects of the ETSAE during these fifteen years. | 4,9 
Asimismo, se pueden ver proyectos planteados para diferentes barrios, diputaciones y pedanías de Cartagena y Murcia, así como para otros muchos municipios de la Región, como La Unión, Los Alcázares, San Pedro del Pinatar, Ricote, Cehegín, Caravaca, Cieza, Jumilla o Totana, y también trabajos emplazados en otras provincias españolas. | Likewise, projects can be seen proposed for different neighborhoods, districts, and townships of Cartagena and Murcia, as well as for many other municipalities in the Region, such as La Unión, Los Alcázares, San Pedro del Pinatar, Ricote, Cehegín, Caravaca, Cieza, Jumilla, or Totana, and also works located in other Spanish provinces. | 4 
Entre los trabajos con la mejor nota académica, está el primer TFE en Arquitectura que fue aprobado en la UPCT, en noviembre de 2014, el de Antonio Zamora Guillén: un centro de sinergias agroalimentarias e investigación diseñado para dar uso al abandonado monasterio de San Ginés de la Jara. | Among the works with the best academic grade is the first TFE in Architecture approved at the UPCT, in November 2014, by Antonio Zamora Guillén: a center for agri-food synergies and research designed to make use of the abandoned San Ginés de la Jara monastery. | 4 
También de las primeras promociones es el trabajo de David Hernández López, presentado en 2015, de diseño de una terminal de transportes para el AVE y un hipotético tranvía en Cartagena. | Also from the early promotions is the work of David Hernández López, presented in 2015, designing a transport terminal for the AVE and a hypothetical tram in Cartagena. | 4 
El proyecto proponía soterrar las vías que llegan a la actual estación de tren y disipar la división con el barrio de Los Mateos. | The project proposed to bury the tracks that reach the current train station and dissipate the division with the Los Mateos neighborhood. | 4 
Entre los primeros egresados con matrícula de honor, están algunos de los que han logrado numerosas distinciones internacionales, como José María Mateo Torres y Tomás Lario Roca, miembros del equipo de titulados por la UPCT que ganaron en 2021 la bienal europea de jóvenes arquitectos. | Among the first graduates with honors, some have achieved numerous international distinctions, such as José María Mateo Torres and Tomás Lario Roca, members of the team of graduates from the UPCT who won the European Biennial of Young Architects in 2021. | 4 
Ambos, junto a la también egresada Marta Sánchez Pérez, cosecharon un premio del concurso internacional Design Against War, y Mateo Torres también consiguió en 2019 el premio de la IE School of Architecture & Design's. | Both, along with the also graduate Marta Sánchez Pérez, won a prize in the international Design Against War competition, and Mateo Torres also won the IE School of Architecture & Design's prize in 2019. | 4 
De igual forma, los egresados más recientes también han obtenido premios, como el que Álvaro Sánchez Garda y Daniel Nicolás Pagán recabaron en el Concurso Ibérico de Sistemas Pladur. | Similarly, the most recent graduates have also received awards, such as Álvaro Sánchez Garda and Daniel Nicolás Pagán who won the Iberian Competition of Pladur Systems. | 4 
Los propios trabajos académicos que se realizan en la Escuela de Arquitectura y Edificación han logrado diversos premios, como uno de los que se incluyen en la muestra, la propuesta de estrategia urbanística para Cehegín y otras localidades del Noroeste de la Región de Sergio Giménez Fernández, que obtuvo el premio del Colegio de Arquitectos en 2020. | The academic projects carried out at the School of Architecture and Building have received various awards, such as one of those included in the exhibition, Sergio Giménez Fernández's urban strategy proposal for Cehegín and other towns in the Northwest Region, which won the Architects' Association Award in 2020. | 4 
También fue seleccionado como uno de los mejores de España en 2019 el TFE de Vicente Rex Lario. | Vicente Rex Lario's TFE was also selected as one of the best in Spain in 2019. | 4 
La muestra permite conocer proyectos creados por estudiantes de la UPCT para resolver problemas de toda índole, no sólo arquitectónicos o urbanísticos, como el diseño de centro enfermedades neuromusculares en el Puerto de la Cadena de Alba Miró Andreu, el centro especializado para pacientes de epilepsia en La Arrixaca de Juan Jesús López León o el hospital psiquiátrico diseñado por Virginia Monreal Martínez, ideado para el paseo Ronda de Cieza, junto al río y con vistas a la famosa floración de los melocotoneros. | The exhibition allows for the exploration of projects created by UPCT students to solve problems of all kinds, not only architectural or urban, such as the design of a neuromuscular disease center in Puerto de la Cadena by Alba Miró Andreu, the specialized center for epilepsy patients in La Arrixaca by Juan Jesús López León, or the psychiatric hospital designed by Virginia Monreal Martínez, conceived for the Ronda de Cieza promenade, by the river and overlooking the famous peach blossom. | 4 
En esta misma Vega Media del Segura se emplaza otro de los trabajos que se exhiben, el proyecto de centro deportivo y agroturístico para la finca El Menjú de Elías Tudela Martínez. | In this same Vega Media del Segura, another of the exhibited works is located, the sports and agritourism center project for the El Menjú estate by Elías Tudela Martínez. | 4 
El centro de divulgación de la posidonia oceánica, diseñado por Virginia Ruiz Guillamón para el parque regional de las Salinas, es uno de los muchos proyectos que los estudiantes de Arquitectura en la UPCT han planteado para el entorno del Mar Menor, como el de Luis López Moya, titulado 'Nuevo edén. Un paraíso terrenal en el borde litoral de San Pedro del Pinatar'. | The outreach center for oceanic posidonia, designed by Virginia Ruiz Guillamón for the regional park of Salinas, is one of the many projects that Architecture students at UPCT have proposed for the Mar Menor environment, such as that of Luis López Moya, titled 'New Eden. A terrestrial paradise on the coastal edge of San Pedro del Pinatar'. | 4 
Los trabajos académicos se mostrarán en expositores desmontables diseñados y fabricados por los estudiantes de la asignatura Proyectos III del grado en Fundamentos de Arquitectura que ha sustituido al anterior grado en Arquitectura y que se complementa con el máster en Arquitectura para otorgar la habilitación profesional que se requiere para ejercer la profesión. | The academic works will be displayed on detachable stands designed and manufactured by the students of the Projects III subject of the Architecture Fundamentals degree, which has replaced the previous Architecture degree and is complemented by the Architecture master's to grant the professional qualification required to practice the profession. | 4 
La UPCT imparte también el grado en Ingeniería de Edificación (anteriormente denominado Arquitectura Técnica), los másteres en Patrimonio Arquitectónico y en Ciencia y Tecnología de la Edificación en Arquitectura y el nuevo doctorado en Arquitectura, Patrimonio y Ciudad. | UPCT also offers the Building Engineering degree (previously called Technical Architecture), the master's degrees in Architectural Heritage and Science and Technology of Building in Architecture, and the new Ph.D. in Architecture, Heritage, and City. | 9 
En el acto inaugural, celebrado este jueves, han participado numerosos alumnos y antiguos alumnos. | At the inaugural event held this Thursday, numerous students and alumni participated. | 4 
Muchos de ellos se han reencontrado en la Universidad años después de haber finalizado sus estudios. | Many of them reunited at the University years after completing their studies. | 4 
La muestra está comisariada por los profesores María José Muñoz, Fernando Miguel García, Pedro García y Antonio Cerezuela. | The exhibition is curated by professors María José Muñoz, Fernando Miguel García, Pedro García, and Antonio Cerezuela. | 4 
Está patrocinada por el vicerrectorado de Estudiantes, Cultura y Deportes; Asemas; Leroy Merlin y el departamento de  Arquitectura y Tecnología de la Edificación. | It is sponsored by the Vice-Rectorate of Students, Culture, and Sports; Asemas; Leroy Merlin; and the Department of Architecture and Building Technology. | 4
